system_id,dataSource,artUrl,artDate,artTitle,artContent,boardID,commentCount,department,gender,school
748,Dcard,https://www.dcard.tw/f/talk/p/254291782,2023-12-31 04:05:19,新竹 粉刺/痘痘中醫推薦,"本人的痘痘史已長達10年，常聽別人說青春期過了就好，但直到現在23歲⋯臉還是反覆的在生長🥲

少說也有西醫吃了6-8年的外用與口服藥，輾轉了好幾家診所，要不是抑制一下就復發、不然就是根本沒用，該忌口的都有忌口（糖、奶、炸的辣的、麵包蛋糕、只要是會讓皮脂腺上升/易致粉刺的東西都很少吃）、臉也會定期清潔～～近半年有接觸做臉店家，膚質有改善，但不知什麼原因，想到就又會突然牙起來⋯而且持續時間非常久，簡單來說還是很容易受外在因素影響，真的真的非常困擾⋯該做的都做了、也都試了都就是沒辦法穩定或是有用。

所以有在想說會不會是身體裡面的問題，可能內分泌或是體質太過於燥熱之類的，才想要尋求中醫，但爬了文⋯有關新竹「治痘/調理痘痘」的中醫店家⋯好像不多，目前看到推的只有華信跟華陽？而且都很久以前了～不知道現在是不是還ok的🥲

目前的話 下巴是會反覆長痘痘（會紅腫的那種）還有閉鎖型粉刺 / 下巴線沿著兩頰基本都是閉鎖型粉刺+一些小痘 / 鼻子、額頭這種常出油的地方基本上反而就都不太長 很奇怪哈哈

再麻煩大家順手推個幾家～我已經快無計可施了⋯也因為臉的狀況一直很自卑、或是更常戴著口罩 不敢正眼看人，好想要很自信的走在路上，而不是一直被人討論我的皮膚狀況😭

盡量都是新竹的會比較好🙏🏼🙏🏼
如果有必要跑到外縣市我也沒問題，只是希望首推會是新竹🥲🥲 有查到也有聽別人說過苗栗的原德好像蠻好的，但很難排隊？",talk,0,xxshuxi_,F,喵喵
749,Dcard,https://www.dcard.tw/f/relationship/p/254291802,2023-12-31 04:09:20,要怎麼面對一個說謊的人⋯,"和男朋友交往快兩年
我真的好愛他 他也對我很好
我們兩個上一段感情都是被背叛
所以對於誠實和坦白很看重
但我因為賭氣說了一個謊騙他
故事如下：
昨天男友出門玩 我心情因此很不好
所以我也故意想要和朋友去唱歌（有男有女）
結果要去的時候包廂時間已經快結束 我就想說好吧那可以順便載我朋友回家（朋友是男的）
結果到了之後朋友說他要在另一個包廂繼續唱
我覺得沒差就慢慢騎回家 而且我也知道載了男朋友一定會不高興 
在家我大概坐了40幾分鐘 
我就又騎著摩托車去男朋友家
想說等他回來跟他一起睡覺
結果男朋友先回到家了 還發現我有打算出去載人
但剛開始我直接撒了謊騙他
男朋友看起來真的好傷心也對我很失望
事發後我也真的好對不起他
一段好好的感情被我一時的情緒打壞了
我們之後要怎麼面對彼此
感情有了裂縫和疙瘩是一輩子都彌補不了的
請問各位如果是你們發生這種事情 會選擇繼續嗎？",relationship,1,,F,
750,Dcard,https://www.dcard.tw/f/talk/p/254291822,2023-12-31 04:13:14,身高高的人搭北捷真的要小心頭,"我身高188，每次要搭個捷運就一定會撞到頭，車廂的門檻超矮每次只要一個不注意一定會撞到頭，還有為什麼扶手的欄杆會那麼矮啦，欄杆剛好就在我的額頭每次只要沒站好就一定會撞到，撞到都要練成鐵頭功了
https://sticker-assets.dcard.tw/images/fe0ae228-e2fd-4e57-9bb2-6bf2d42ed51b/orig.png",talk,3,f3778319,M,Jh
751,Dcard,https://www.dcard.tw/f/talk/p/254294841,2023-12-31 12:14:50,請問北部百貨公司哪間平日晚上比較多人？,"請問大家 ，因為想要擴點去北部
目前有下面地方

1.新北宏匯廣場2F
2.新北環球百貨2F
3.桃園台茂 
4.捷運忠孝敦化-第六廣場 
5.新竹遠百竹北7樓

哪一邊平日晚上比較會有人
不要只有假日才會有人的QQ
有一些百貨平日都沒人...........
https://sticker-assets.dcard.tw/images/bc5585a0-eec1-4e08-b080-c7d8bb972cf2/orig.png",talk,0,rabbit0963,F,鑽牛角尖金牛
752,Dcard,https://www.dcard.tw/f/relationship/p/254294884,2023-12-31 12:21:20,女生若被性侵如果發現很合的話，心裡是怎麼想的,"我其實這個問題從來沒有想過欸
因為這實在是太狂的一個問題
很多女生會抱怨性事不合
倘若遇到的是性侵但發現卻跟對方性器很合
那事後會哭還是笑？",relationship,3,,M,
753,Dcard,https://www.dcard.tw/f/talk/p/254294852,2023-12-31 12:16:22,XO(Rooit)鑰匙交換,目前有RooLover、心情、西斯、Kpop 鑰匙各3把，想要幣圈月老、onlygay、Lestalk等其他鑰匙，意者私,talk,2,,M,國立中山大學
754,Dcard,https://www.dcard.tw/f/talk/p/254294849,2023-12-31 12:16:16,請問現在有什麼匿名軟體可以玩嗎,給個建議吧各位,talk,1,sam7036680,M,霆
755,Dcard,https://www.dcard.tw/f/relationship/p/254294917,2023-12-31 12:27:03,初戀分手真的好痛,"交往一年多
分手一個多月了
他是我的初戀
第一次認認真真愛過付出過的人

我知道我們一直都有問題
但或許我想嘗試溝通的的時候表達方式錯誤（常常講到哭/崩潰）他覺得照顧我的情緒很難吧 
我會一直想到當初在一起的時候 說有一點小情緒也要提出的不是你嗎 為什麼到後來對我的情緒好像視而不見 不想面對⋯
而他的問題是知道有問題卻也不提出
這樣耗著我很痛苦的提出分手 但我真的還很愛他
不過他答應的也很果決⋯

看著他好像很快的走出來
我卻還這麼痛

我快受夠現在的自己
一直猜測他的每一個動作
想著是不是還有機會🥲",relationship,3,,F,
756,Dcard,https://www.dcard.tw/f/talk/p/254294912,2023-12-31 12:26:29,台北跨年演唱會像蘿蔔的螢光棒,"請問有人知道台北場現場觀眾手上保齡球造型
像蘿蔔又有點像胖版蔥的螢光棒是什麼嗎？",talk,2,,F,國立臺灣師範大學
757,Dcard,https://www.dcard.tw/f/mood/p/254294920,2023-12-31 12:27:44,有時候我就在想,"現在的我已經快畢業了，
有時候就在想那時曾經霸凌過我的人 ，
現在過得如何呢？
至今已過了8、9年，
講真的時間會沖淡，
那時的痛苦、難過、生氣、害怕⋯⋯，
而到了新的環境，認識新朋友 ，
創造許多美好的回憶 ，
過著和一般人沒什麼兩樣的日子，
只能說，我很幸運沒被困在回憶的漩渦裡，
但偶爾夜深人靜或一個人的時候，
那些陰影會撲向我，
而今天剛好就是這個日子：
想起有人在耳邊說「妓女學校畢業的」；
想起有人在我眼前踢翻我的桌椅；
想起有人在課堂上詢問老師一些剛好可以用來嘲諷我的問題；
想起原本以為唯一可以信靠的朋友，
居然秘密的和霸凌者傳紙條；
想起全班在我轉學的那天歡呼著，叫我快滾；
想起當我向班導求救時，她說那只是同學之間的玩笑；
想起和輔導老師不舒服的約談過程，讓我不禁懷疑為什麼會有種被審問的感覺？
最好笑的是，找來家長們開協調會議後，
我要回教室拿東西，居然碰到她的幾個好朋友堵在門口，跟我說：「妳知道妳這麼做，她回家會被打嗎？」

有時候我就會想⋯⋯
電視上大多劇情都有校園霸凌的成分在當中，
你們看到了，會想起自己曾是那個令人憤恨的角色嗎？
有時候我也會想⋯⋯
幾年後，也就是現在，
你們或許過著美好的日子，
沒有半點被霸凌的痛苦回憶，
過著一般的生活，
可能步入社會了，可能有另一半，
有了新的朋友圈，未來可能會有孩子，
但他們不知道你們曾經是霸凌者的身分，
實在是太可惜了⋯⋯

所以不要跟受害者說「不要在乎理會」，
我們都是有情感的人，
不然為什麼已經過了近10年，
所有事件細節依舊清晰呢？",mood,0,,F,
758,Dcard,https://www.dcard.tw/f/mood/p/254295148,2023-12-31 12:58:38,單身 家庭不幸福,"跨年了
大家不是跟家人出國
就是跟另一半甜蜜
ig通知不停
家庭不幸福的我
沒家人的愛
沒有另一半的陪伴
為什麼全世界都這麼幸福
https://sticker-assets.dcard.tw/images/93f72bec-da61-45ea-b623-1486d84726b7/orig.png",mood,5,,F,
759,Dcard,https://www.dcard.tw/f/talk/p/254295123,2023-12-31 12:54:46,尋親記,"就是因為姓氏非常特別。從小就一直聽家人說親戚在大陸那邊的故事，其實父親也很想要去看看那邊親戚但因為爺爺在十年前就過世了因此就失聯了所以發出這篇文章就是想要找找看在台灣有沒有同樣姓氏的人碰碰運氣看能不能遇到自己的親戚！！
據說老家在浙江省東陽縣橫店鎮
阿對！我姓厲！",talk,2,frog12345,M,丹尼爾先生
760,Dcard,https://www.dcard.tw/f/relationship/p/254295121,2023-12-31 12:54:34,學姊穿短裙陪我打羽毛球,"https://www.dcard.tw/f/gov_employee/p/254287904

大大的眼睛、挺直的鼻樑、小巧的嘴唇
清湯掛麵的學生頭
一張非常具有特色的臉蛋
帶有一絲原住民般的神秘氣息，
以上，就是我對隔壁學姐的第一印象

下班前的零碎時間，我站起來
「整天坐辦公桌，屁股快裂開了」我向坐身後的學姊抱怨
「那午休時間要不要去頂樓打球呢?」學姊提議
「學姊會打甚麼球呢?」我好奇問她
「不然一起打羽毛球好了」學姊提議
反正我午休也睡不著
陪學姊殺時間順便交流同事感情也不錯
於是我就答應了

隔天早上，學姊來上班
她向我說早安
我想她今天應該會走運動風
於是轉頭回復早安
這一回頭還真是不得了
她穿著淡粉色的短袖Ｔ恤
再罩著一件黑白條紋的小背心
最重要的就是那條輕飄飄的黑色短裙啊啊啊啊！
原本就不長的短裙只能遮住半條大腿
配上過膝黑長襪
看起來彷彿是青春洋溢的高中少女
不禁勾起小弟魯蛇般的男校生活回憶
那段每天上學搭公車通勤的日子
對女孩情竇初開的懵懂歲月
總是喜歡目視漂釀女生
但是被發現又會害羞地閃避視線
我看著學姊玲攏的曲線進入放空狀態
「怎麼了，我打扮的很奇怪嗎?」學姊在我面前轉一圈
只能遮住半條大腿的短裙此時也輕輕的飄起
我的視線也跟著往上浮
頓時瞪大了眼睛，嚥下一口水
裙擺落下後我才恢復理智
「學姊看起來真年輕! 好像大一新生制服日的穿著」
「你嘴巴真甜，人家已經大學畢業了啦!」學姊開心地回答

很快地，午休時間到了
我和學姊走到電梯前
不幸地電梯壞了
「看來我們只能走樓梯了」學姊無奈地說
「我不知道羽球場在哪裡，學姊能走前面帶路嗎?」
其實我知道羽球場地點，要學姊帶頭的目的當然是......
我們開始走樓梯
我往後看發現四下無人
而學姊搖搖晃晃的翹臀就在我眼前
邪惡的念頭一閃而過
只要現在我彎下身子肯定能看到她的胖次
「學姊肯定有穿安全褲......」我試著說服自己不要動歪腦筋

到了球場由於時間不夠，我們沒有做暖身運動
站好場地，我們開始打球
學姊拋起球，狠狠地拍出去
羽毛球在空中飛舞出一條漂亮的拋物線
雙方來來回回數次
「暖身也差不多了吧! 我要認真了!!!」學姊自信地說
醉翁之意不在酒
邪惡的念頭一直在腦海盤旋
我是一隻垂涎獵物的野狼
而學姊胖次是不知情的小白兔
「要是能讓學姊跳起來殺球的話......」我真的好想知道她胖次顏色
於是我故意打了個高飛球給學姊
「我不會讓你的!!!」學姊興奮地注視著羽毛球
「你能接下這球嗎?」學姊助跑兩下，膝蓋微蹲後躍起身子
眼見機不可失，我大叫一聲好痛
然後假裝腳抽筋跌倒在地
在我著地前的幾秒鐘，我一直注視著學姊的裙下
學姊的胖次是劃過天際的燦爛流星，轉瞬即逝
我把握機會許下今生最大的願望
願望是希望學姊沒有穿安全褲
色瞇瞇的視線像迴游的鮭魚一樣
從學姊的膝蓋力爭上游直到大腿根部
白皙的大腿一覽無遺，真的沒有安全褲
讓男人魂不守舍的三角地帶還印著一隻天竺鼠車車
裙襬落下，宣告美好的時光謝幕
令人唏噓不已

學姊著急地跑過來查看我的狀況
「學弟，你還好嗎?」學姊站在我旁邊
我抬起頭想回答她
但在眼前的並不是羽球場的天花板
而是學姊的天竺鼠車車
此時我的大腦已經無法克制自己的小兄弟
在小兄弟膨脹到會被學姊發現前
我馬上坐起身子揉自己的小腿
「學姊抱歉，我平時沒有運動的習慣」
「沒關係，我知道怎麼處理」
學姊輕輕按摩我的小腿
並將抽筋部位的肌肉輕輕拉長
「如何，有好點嗎?」學姊關心地說
「謝謝學姊，好多了」
「那要不要試著站起來?」學姊試著拉起我
我的小兄弟都還沒退燒，站起來不就被學姊發現
「學姊，我還是在坐一下好了」
「午休時間快結束了，不然我扶你回辦公室」
我想身子略往前傾應該就不會被學姊發現
學姊將我的右手搭在她的右肩上然後緩緩站起
頭一次與學姊的距離這麼近
四周都是學姊流汗所散發出的費洛蒙
本來逐漸疲軟的小兄弟又開始抬頭挺胸
都說男人無法區分愛情和性慾的差別
我似乎開始對學姊產生一種難以言喻的情愫
「這種悸動感到底是......」感覺自己被學姊搞糊塗了
未完待續......
本文只為創作文，筆者覺得原文主角人設不錯，因此試著續寫，並非真人真事改編，如有雷同，存屬巧合，煽情的內容請各位包含",relationship,0,,M,國立臺灣大學
761,Dcard,https://www.dcard.tw/f/mood/p/254294542,2023-12-31 11:25:57,學校是很封閉的地方,"我覺得校園內的問題老師跟學生一樣，難處理。
每次看到這種貼文，總是有人留言在那麼說：你應該要跟師長報告，尋求正當管道之類的…幹話。
有用的話，就不會有這麼多莫名其妙的事情了！
你以為這樣有用嗎？ 高中畢業之前我跟我的家人寫信來去教育部，結果教育部通知學校然後他們也沒有處理啊！就教育部回函表示處理完成 那個不適任的老師還是在 輔導室的老師還來跟我說類似
《他們也處理不了那個老師》 最後，反正因為考完學測 我也請假到畢業了 這個事情就這樣結束了
不過我現在還對老師的言語跟針對很憤怒，畢業6年了。",mood,0,ride_the_rider,M,就地掩埋
762,Dcard,https://www.dcard.tw/f/talk/p/254294663,2023-12-31 11:48:14,今年孤零零一個人,"有沒有人今年也是無局的呀
我們也要讓其他知道 我們並不孤單啊
哈哈哈 歡迎各位來聊天",talk,0,thetea0106,M,台南遊俠
763,Dcard,https://www.dcard.tw/f/mood/p/254294660,2023-12-31 11:47:46,2023的最後遭到職場霸凌,"再過幾小時就要迎來新的一年，先預祝各位新年快樂！
不過就在我悠哉度過這最後的時光，鳥事卻突然發生在我身上⋯

我在一家英文補習班當工讀生，暑假時因一些因素，到別的部門幫忙，工作內容就是打打講義、製作詳解等，也因為工作內容跟學術有關，所以主管是補習班的一名授課老師。授課老師平常要處理很多事情，因此平時打講義的工作都讓我們詢問一位較資深的工讀生（以下簡稱A）。那時我們並沒有任何恩怨。

前情提要結束。

某天，我在開始工作前，先花了不到20分鐘把路上看到的單字記在記事本上（私人事務），剛好A經過，看到我沒有在做正事，破口大罵，連隔壁辦公室的同事都聽得到。雖然不解為什麼是由A來指責我，而不是我的主管，但因為自己確實沒有做份內事，想一想也沒有太在意。沒想到過了這麼久（暑假到現在），報應終於來了。下午同事傳訊息來，說A竟然把他對我的厭惡出成克漏字，當作學生的測驗卷題目（該說他厲害嗎⋯），內容不外乎就是抱怨我很自私、破壞團隊和諧（每個工讀生都是做自己的事，哪裡來的團隊🤔）、愛挑輕鬆的工作做（我們的工作都是A直接分配，他每次都是拿最難的明星學校考題給我做，自己負責打雜誌的逐字稿）。

除此之外，因為我是外縣市人，暑假沒有回家留下來打工，但同時也有投其他公司的實習（尚未公佈錄取結果）。那時我就問主管能不能在錄取結果公佈前多排班，之後看有沒有錄取實習再調整班表，主管讓我去問A，我便禮貌地私訊他。沒想到今天被他拿出來大做文章，說我不看重工作，想來就來想走就走，是個很隨便的人。看到這裡真的有點不太舒服，我只是一名工讀生，到公司上班是因為我需要錢，而公司需要我的專業能力，就只是各取所需的關係，並沒有把我的靈魂賣給公司，更何況工讀生就是領最低薪資，我希望能有更好的待遇，投實習應該也是人之常情。最讓我不解的是，A明明也是工讀生，領的也是最低薪資，但他卻有不知哪來的優越感，代替主管來指責我，覺得我不當公司的狗就是不尊重工作。

根據同事所說，主管已經知道這件事，並承諾會處理。不曉得各位有沒有遇過這種奇怪的同事😨

感謝看完文章的你，新年快樂！",mood,3,,M,
764,Dcard,https://www.dcard.tw/f/relationship/p/254294693,2023-12-31 11:52:28,究竟是我要求太多，還是男友沒心⋯,"我們已經在一起兩年多了，一開始男友其實真的很有耐性也對我很體貼
慢慢的好像越來越不貼心 想的只有自己
我是一個買什麼吃的用的 都會想到男朋友喜歡吃就幫他買一個，他什麼東西快沒了 就幫他順便帶的人
但是我慢慢發現他每次買東西，好像都只有買自己的，因為他家裡只有他跟他姐姐 而他姐姐大他12歲 也已經結婚沒住家裡，所以在他家 他就算是獨子 他爸媽都蠻疼他的（什麼事都會幫他做做好好一樣
然後我家有四個兄弟姐妹，所以從小就比較會幫兄弟姐妹買東西跟分享
我不知道是家裡因素的問題，還是男友本身就是沒有想照顧我的意思⋯
然後我其實脾氣很差，但是在一起之後我覺得我真的慢慢在為他改，不論是講話方式 對待感情的態度
然後反而他現在比較會對我不耐煩，這個問題其實也吵過蠻多次的⋯他都會說 他以後講話會經過大腦之類的道歉
但是時間一過，其實就是一直重複上演！
我也覺得很受不了 但是我又覺得 都在一起這麼久了⋯一直跟他反應他也是這個樣子
讓我覺得蠻累的🙁可是有時候又相處的很好⋯
讓我很矛盾到底要怎麼解決
其實我要的不是我說什麼他做什麼，只是覺得為什麼都要我說 你才會做
我要的跟你主動給的，怎麼會一樣⋯
男友現在就只會擺爛 講了也不會認錯
-
其實一開始他在追我的時候
我有其他三、四個人也在追我，我不敢說一定都是百分之百用心 也不一定可以在一起這麼久
但我總覺得⋯你當初說不會讓我後悔選擇你
而你現在做這些是想逼我離開吧⋯

還有很多時候 我都會跟他說你一開始為什麼可以對我這麼好什麼的，他都會說 那是之前
又或是我講他哪裡 我很受不了
他就會回：我本來就這樣啊

有時候他很像小孩子，感覺要我時時刻刻照顧他
提醒他、開導他 但是又不想聽
吵架了才會知道錯，過段時間又開始
只是想被人捧在手心上錯了嗎😢",relationship,1,,F,
765,Dcard,https://www.dcard.tw/f/talk/p/254294578,2023-12-31 11:33:36,請問一下有拜過四面佛的卡友們,想請問一下，有拜過四面佛的卡友們，請問女生生理期來可以去拜嗎？這樣會不會對大王不尊敬呢？,talk,0,aa083425,F,藍莓巧克力
766,Dcard,https://www.dcard.tw/f/relationship/p/254294585,2023-12-31 11:34:05,那就不要講讓人誤會的話啊,"一開始當朋友就好了啊
說什麼很懂我，喊什麼曖昧的稱呼，最後又不理我
還在現動覺得自己是壞人？是爛人謝謝

不管說什麼刻骨銘心的話都不要相信，他的過去他的傷痕他的心情，他睡不著的那些夜晚，對男生來說都是過往雲煙，是一團屁，放完就是誰管你，你還在那邊覺得跟他更進一步
想太多，就是吸了一口臭氣，他舒爽了你還在煙燻

都不知道要生氣還是要難過，心情好複雜",relationship,0,,F,
767,Dcard,https://www.dcard.tw/f/relationship/p/254294609,2023-12-31 11:37:58,要怎麼樣才能交到男友,"本人23歲，中部人~
請問要怎麼樣才能遇到正常的男生~
玩交友軟體玩得很心累QQ",relationship,12,,F,
768,Dcard,https://www.dcard.tw/f/mood/p/254294653,2023-12-31 11:46:10,Re: 這樣的存款算多還算少🤔,此篇文章為轉貼文章，請更新至最新版本觀看完整內容。,mood,0,,F,
769,Dcard,https://www.dcard.tw/f/talk/p/254294662,2023-12-31 11:48:10,台北麻將-2,"大家好，想問目前有想打牌的朋友嗎？
可以約在棋牌室，目前-2人🥺",talk,2,julyzzz,F,Julyz
770,Dcard,https://www.dcard.tw/f/talk/p/254294695,2023-12-31 11:53:04,請問這是哪首歌！,"剛剛吃飯的時候聽到
我很努力的想聽清楚歌詞
但我聽出來前就唱完了…
副歌的音調跟旋律大概是

E E DE - | EE EE FE

是一首中文女歌手的歌
很像王詩安的歌 但是剛剛找都沒有
希望有人可以幫我想到
不然一直想不出來真的好痛苦
https://sticker-assets.dcard.tw/images/93f72bec-da61-45ea-b623-1486d84726b7/orig.png",talk,2,,M,國立中央大學
771,Dcard,https://www.dcard.tw/f/relationship/p/254294643,2023-12-31 11:44:11,愛約砲噁爛男,"如題。
男友三番兩次用Omi約砲被抓包，還不准我翻舊帳
最近被我發現車上有保險套和休息卷
居然還可以掰說那是他朋友的
我真的覺得男人約砲被抓包還死不承認到底有多不要臉
他都不知道自己的謊有多牽強
推算時間是我前陣子身體還在休養的時候
那時候他還常常一副捨不得我的樣子
說什麼他真的沒辦法對我下手 所以他很忍耐
幹放屁 殊不知都花錢帶炮友自己去爽
真的祝你爛掉

他說的朋友
也是個有老婆小孩還到處約砲的科技男
物以類聚的敗類
約砲的人要小心
因為我發現男友私密處有不明丘疹（菜花）
我已經很久沒跟他做了
被他約到的人真的要小心
太噁了


特徵
戴黑框眼鏡（約砲的時候可能會戴隱形眼鏡）
身材微胖（83）  身高175
臉有很多痘痘
誠意炮友（他車上就有岡本002）
很會跟女孩子聊天
最喜歡跟人家早安安、晚安安
常常問人家三餐吃什麼
喜歡口交
還有他會偷拍影片
開白色苦瓜 或米漿老車
最常約在新竹旅館（薇閤、湖山）


馬的平常交往沒讓他支出什麼
他也省得要命
結果帶別人去旅館爽倒是滿大方
還給我買休息卷
有空的話怎麼不去死一死
湖山還是我帶他去他才知道的 幹玲涼死渣男
真的祝他爛掉


目前已經謝謝再聯絡
被約的人要小心被傳染
幫高調",relationship,3,,F,
772,Dcard,https://www.dcard.tw/f/talk/p/254294568,2023-12-31 11:31:58,提前的新年快樂,"先和大家說聲新年快樂，希望各位明年順利，想轉學考的都成功，想得高分的都成功，想交到伴侶的都成功，大家都能夠心想事成。
https://sticker-assets.dcard.tw/images/8517c300-81e1-4e93-a08f-25742d5738af/orig.png

2024大家快樂幸福
希望我明年暑轉和複合都成功！",talk,1,,F,銘傳大學
773,Dcard,https://www.dcard.tw/f/mood/p/254294573,2023-12-31 11:32:49,身邊朋友都是有錢人 心裡該怎麼平衡,如題 我認識的朋友基本上都算有錢人 或是小康 過的不錯 但雖然我家地段好 但本身卻很窮 每次看到朋友買了甚麼酷東西 或是生活過得多采多姿 心裡就非常的難過 因為我自己的家庭沒那麼富有就算了 還常常因為一些破事吵架 然後家人又管超多 這使我心裡非常的不平衡 有人能告訴我怎麼讓心裡平衡一點嗎,mood,1,,M,
