system_id,dataSource,artUrl,artDate,artTitle,artContent,boardID,commentCount,department,gender,school
1,Dcard,https://www.dcard.tw/f/relationship/p/254295873,2023-12-31 14:43:07,男生想分手會直接說嗎,"前陣子因為一些事吵架，和好後男友就變的很冷淡…就連我主動破冰也是，之前都不曾這樣…吵架是因為之前有不小心瞄到男友跟其他女生聊天，但當下沒勇氣問清楚，自從那次之後，自己就變得很沒安全感，後來又知道一次所以吵架，男友覺得我無理取鬧

想問問大家如果男友不再主動傳訊息，已經失聯一週，是不是已經不愛了，不愛又不願意說清楚的原因是什麼😢難道這就是斷崖式分手嗎？💔",relationship,3,,F,
2,Dcard,https://www.dcard.tw/f/mood/p/254295642,2023-12-31 14:10:38,今年真的是糟透了,"半年前二伯（爸爸的二哥）走了，11/1爸爸急性心肌梗塞也走了，12月大嬸也走了，幾乎是在半年的時間內家族走了三人，走了最深愛的爸爸..

看著一年也將結束，本該是團圓的好日子卻格外空虛。看著身邊的人都沉浸在新年的喜悅，我卻失去了快樂的權利。

擁有世界上最好的爸爸是最大的幸福，失去他也是最痛最深沉的悲劇，爸爸走了以後世界好像就少了一些色彩，所有的興趣跟喜悅都褪色了，世上似乎沒有什麼值得留戀，但回頭看到媽媽和弟弟，我知道家裡不可以有任何一個人再出事，所以日子難過還是過，他們兩個一定比我還痛苦，一個是陪在爸爸身邊最久的人，一個年紀比我還小就失去爸爸，未來是這麼的遙遠又漫長…

然後真的不要再說他希望你好好的活著、他永遠在你心裡、你要堅強、節哀等等的「屁話」，除了沒用只是讓人不敢面對悲傷。依照完形心理學的概念，悲傷是段必經的歷程，必須把它走過。那些真的憂鬱、走不出來的往往都是沒有好好表達思念或情緒的人。

失去摯愛的親人，安慰是  沒  有  任  何  一  點  效  果  的，越講只是讓人越不開心。我想，陪伴已經足夠，剩下只能靠我自己用淚水清洗心裡的傷口。

我花了22年習慣有他在的生活，走出來本來就需要一段時間，只是，真的好漫長、好難過…

今年 真的是糟透了",mood,0,,M,
3,Dcard,https://www.dcard.tw/f/mood/p/254295911,2023-12-31 14:48:48,如果,"有些東西不想錯過
有些東西不想放下
有些東西不得不逼自己狠下心
讓自己強迫放下

有些東西你既然選擇放下分手時
就不該繼續做一些讓人疑惑的動作
或者繼續賴我說一些小事
分享八卦 甚至說一些
你有誰跟你開玩笑的告白
更不要說你對誰是可以
誇獎她眼睛如何漂亮

當你在用你的方式來告訴我時
你是不知道告訴我這些都是一種傷害
還想跟我退回朋友
朋友怎麼退回

如果還喜歡還愛 
誰會甘心只停止在朋友的界線
在一起時你也說過
我們沒有什麼東西可以分享

分手後再來跟我分享
我都搞不懂你到底想幹嘛

當初既然選擇分手覺得不合適
那就過好各自的生活
不需要在打擾各自的心情

當你挑撥我的情緒時
你有沒有想過你用你的方式
不是安慰我只是一直在刺激我
而我選擇用你的方式來對你
你就受不了了 
要我去認識其他男生
我也去認識了
你知道後卻自己受不了
嘲諷我 夾槍帶棒

本來我不想這樣搞得
會因為你敏感 會因為你說的每一句話
受到委屈難過刺激
讓自己變得不像自己
 
你我既然都錯過了
你也決定分手了
我也決定放手了

讓我們彼此各過各的生活
你去找你想要的女生
在一起不需要磨合就可以在一起很久的女生

而我繼續過好我要的生活
你也可以 
不要再別人面前再裝你多深情
你多受傷 大家都是成年人了
拜託不要這麼幼稚了好嗎？",mood,2,,F,
4,Dcard,https://www.dcard.tw/f/mood/p/254292800,2023-12-31 06:48:54,好累,"今天的我只想在家躺著 睡到不省人事
因為這幾天我真的好累
跟另一半同居 他的作息時間比我晚很多
我也已經好久沒有一整天自己一個人了

今天跨年夜 應該是最快樂的時候
沒辦法順著自己想睡的心 被另一半拖出門吃東西
好不容易喬攏要吃的東西
到現場後因為遇到熟人趕快換一間

到第二間店 送完菜單跟店員說桌號後
等了快半個小時還沒有餐點送上桌
才發現剛剛的店員以為我們已經點好了

吃完後的我滿肚子氣 我只想回家
但另一半說想去車站逛逛走走
不想掃興的我也決定配合他

在走出那間店過沒多久
我的頭就撞到人行道旁 在柱子上的牌子
已經好生氣和難過了 這一天彷彿在跟我宣戰

他是偏鄉來都市讀書的
很喜歡建築物跟車站之類的東西
但我真的已經習慣這些東西了
他覺得新奇的東西我覺得司空見慣

我以為我不想掃興的選擇 會讓兩個人都開心
結果我反而更生氣 更難過 更無力

眼前的這個人真的是我愛的人嗎？
我有過著讓我舒服的生活日常嗎？

我真的好想死！！！",mood,1,,M,
5,Dcard,https://www.dcard.tw/f/talk/p/254295864,2023-12-31 14:42:32,臺北市私立大同高級中學 吳O羽同學你的學生證掉了,,talk,0,,F,國立政治大學
6,Dcard,https://www.dcard.tw/f/relationship/p/254295677,2023-12-31 14:16:19,今年最大的收穫就是遇見了你4️⃣,"這次的見面是前1天才約的🤣
還好我沒有排事情

前1天
他丟了一部電影預告片給我
問我有沒有興趣
我看完預告片覺得還不錯
不過3部都沒看過
而這次上映的是前傳
想說能見到他
即便看不懂電影也沒關係
於是
我學他回：走呀🤣
他：那明天下班我去找你，先吃飯再看電影吧😊
我：好哦☺️

2023.12.08
當天上班
心思一直沒在工作上😅
等了一整天
總算等到下班
東西收拾好快步走出公司大門
深怕臨時有公事要處理

離開公司
我訊息他：我下班了
幾分鐘後他訊息我：我到了，你慢慢來
我加快腳步去找他
我：我到了，去哪裡找你？
他：走進來
我踏進大門沒幾步
他出現在我眼前
並開心的說：我找到你了🤣

我們往美食街方向走
最開始經過一間鐵板燒
我繼續往前走
想先找位置
回頭一看
人在離我有10步的距離
我看了看他，問：怎麼了？
他說：這個鐵板燒好像很好吃耶！
我說：哦～那我們坐那邊（看到有空位）
沒打算要理他關於鐵板燒的事😂

坐下來後
我：你先去看看你要吃什麼吧！
幾分鐘後他回來跟我說：應該讓你先去買的，我有選擇障礙🤣
我說：沒關係 我已經看好要買什麼了
迅速的點好餐
回到位置上坐下
沒多久餐點好了
我們邊吃邊著聊天

當我差不多快吃完
還剩一碗湯的時候
有一群家人正好在找位置
看到我們旁邊有空位
便坐了下來
然後其中一位媽媽站在我們倆旁邊
對著她的家人說「沒關係，你們先坐，他們快吃完了，我等他們。」
我聽到這段對話
我們倆互看了一眼
我把碗裡的料吃完
跟他說我們走吧！
離開後
我跟他說：傻眼餒！第1次遇到這種的😒

吃太飽的我們
決定就慢慢搭手扶梯上去
上樓中
我看到前面有對情侶牽著手
可惜他站在我斜後方
不然蠻想知道
他當時有沒有看到
是什麼表情
會不會有什麼動作😂

到了電影院
取完票後
還有一些時間
站在外面聊著他要出國的事
跟我分享著他想去的地方
看著他那樣有自信的說著
眼睛都離不開他😆

後來
看電影的過程中
我被劇情突如其來的爆破嚇一大跳
還被殘忍的殺戮震驚到用手摀住嘴巴
我發現他會時不時的看向我
然後笑著我的反應☺️
我們倆也會看著看著頭就偏向對方那邊

看完電影已經快11點了
他：欸 我們要趕快走了，不然我沒車回家
我：哦哦哦 好 我們趕快走吧
走太趕的我，硬生生的用大腿去撞椅子（痛🥺
他：你累了嘛 小心啦

陪他走到車站
直到我們要分開的路口
我：（手指著前方）往這裡走下去就能去搭車了
他：（他往我指的方向走，而他的手順勢的握了一下我的手😳）好 你到家跟我說哦
我：你到家要跟我說哦

後來我搭上公車
他訊息我：哭😭 班次延誤了
我：嗚嗚嗚 怎麼會 沒關係 我陪你 等你到家我再睡覺

我本來想弄好所有事情
等他到家我就去睡覺
結果我等到他到家才去洗澡🤣

我們的第4次見面
到此結束🔚

而我們的故事
未完待續⋯

https://sticker-assets.dcard.tw/images/764ff643-b618-4691-8e8b-7646a4d86e2d/orig.png",relationship,0,chentina1995,F,愛蛋黃哥的女孩
7,Dcard,https://www.dcard.tw/f/talk/p/254295689,2023-12-31 14:18:19,怎樣才能認識穿瑜珈褲的女生,"我真的很喜歡那種貼身的身形
很誘人 可是身邊的女生身材都不夠好不然就是沒在健身不積極
只想靠目前的年齡優勢去找男友
沒有想到如果分手了 年齡萬一過了 蛋白流失
年輕的不努力就該要面對了
正所謂「少壯不努力，老大徒傷悲。」",talk,1,,M,銘傳大學
8,Dcard,https://www.dcard.tw/f/talk/p/254295692,2023-12-31 14:18:31,母胎單身的跨年,"原來我不是孤單一個人，還有人跟我一樣
",talk,0,a850327,M,母胎單身27年
9,Dcard,https://www.dcard.tw/f/mood/p/254295887,2023-12-31 14:46:08,車禍腳斷掉的你,"剛復原又被公司強迫離職
到新公司有被強迫離職
陳先生不是每一個都吃你那一套
是不是想耍小動作
結果通通無效對嗎？
大家都互不認識
但是大家都排擠你
肌肉棒子只想強詞奪理
現在這裏沒有你太好了
跟你共事實在太累了
趁你病把你趕出公司是對的",mood,0,,M,
10,Dcard,https://www.dcard.tw/f/relationship/p/254295917,2023-12-31 14:49:21,其實仔細想想他也沒那麼愛我,"2023最後一天了，我在聖誕節前夕23號那天收到他的分手訊息，大致上的內容就是他壓力太大了，事情太多了顧及不上我這裡，對我說我很好不想再浪費我的時間，我對他的好他都有放在眼裡，我後來打給他跟他講了快一個小時，最終我尊重他的決定。

我們也很倉促的在一起，認識一個多月而已，我知道很好笑，自認為自己是特別的那個，他說他當初就是看到有希望，才選擇跟我在一起，但他只看到我好的一面，當在一起後我小女孩我那不成熟的撒嬌對他來講都是壓力的存在。

跟他在一起，我覺得失去自我，我每天都在懷疑他是否喜歡我是否愛我，一直不斷內耗自己。

他也很常忘記有約，然後一口氣答應我之後，當天才說那天跟朋友約好了不能陪我，而我總是說沒關係你去吧。

現在想想這段感情我過得多麼卑微真的是很好笑，現在我想我是不愛他了，畢竟時間也沒多長他也沒多愛，那我又何必自作多情？

2023快結束了2024快來了，希望新的一年我不急於愛情，而是把心思放在自己身上成為更好的人。

感謝各位看到這裡，也願大家心想事成，平安快樂。

題外話，不知道為什麼最近做什麼事情都不起勁，劇追完了就像個空殼一樣🫠",relationship,1,,F,
11,Dcard,https://www.dcard.tw/f/mood/p/254295706,2023-12-31 14:20:39,苦澀的2023,"也即將揮別2023年了，

這一年走的步履闌珊，

接受了自己的不足，轉換了工作方向，

慢慢整理內心裡的糾結情緒，

接受自己感情再次的失敗，

看著最熟悉的陌生人與別人結為連理，

每一件事情都像是難嚥的苦藥，

而在這即將結束的2023，

灰暗的人生隧道哩，似乎開始出現了一些光亮，

帶著些許的希望準備跨入2024，

期望成長的不只有年紀。

依然還有想做的事情。",mood,0,mail.kevin,M,一個打工仔
12,Dcard,https://www.dcard.tw/f/mood/p/254295723,2023-12-31 14:22:33,好希望你從來沒有出現在我的生活裡,"我一直覺得我被家庭綁架了

我家是單親家庭，我有一個大我一歲的哥哥，媽媽一個人扶養我們長大。

從小我跟哥哥的關係算是普通，不會特別好但也不會到不好。
大概國中青春期的時候哥哥發現電腦有我看成人片的瀏覽紀錄，有一天他突然提出要跟我互相口交試試看，我當然是拒絕了因為覺得很怪。
忘記過了多久全家人跟親戚一起去礁溪泡溫泉，他游過來對穿著泳裝的我又再度開了黃腔，不知道是不是這個原因，我開始對他碰到我這件事情很反感。

高中的時候因為我讀的是私校，幾乎一到六都要去學校，每天從早待到晚，高三時星期日也要隔週進學校導致我待在家裡的時間很少，家裡大大小小的事情都變成只有媽媽跟他分擔，漸漸的就埋下了之後紛爭的導火線。

大學的時候因為去外縣市讀書所以搬去外面住，台北的繁華生活加上第一次感受到打工可以賺到錢的喜悅，我變得不會每週六日都回家，但基本上隔週一定會回一次家。
因為家事的紛爭開始變得愈加頻繁，媽媽覺得很累，他覺得媽媽不公平偏心我因為我不在家都可以不做家事，但他每週乖乖回家他都要做一堆家事。


看到這裡不知道大家會不會疑惑到底家事能有多多？
我家是透天五層樓，我媽有強烈的潔癖，每週都要擦地板樓梯要一格一格的用抹布擦過，廁所也是每週都要大洗一遍，這些都只是每週的routine work
這種大事我不在家的確無法參與，但像倒垃圾洗衣服晾衣服這種基本上都是我做


我出社會沒多久後我哥跟家裡徹底鬧翻，我的第一份工作是必須早出晚歸的性質，休假也都跟週休二日的他們對不上，想當然爾他的怒火有更大了！

從大概三年前他就跟我媽說他不做家裡的所有家事，嗯！他真的說到做到，他現在在家裡就是大爺，享受著家裡的資源，在房間的時候影片遊戲聲音放到最大聲，也不管有沒有人在休息 會不會吵到其他人。所以我跟他的關係也徹底惡化，在家裡我們就是陌生人，我們不會對話，但可笑的事情是我還要幫他洗衣服晾衣服倒垃圾。


我哥現在對我媽的態度也是非常差，不會叫他「媽媽」也是當個陌生人，我媽關心他他會陰陽怪氣的回我媽要不然就是罵他。
我很想搬出去住，但一想到如果我逃出來了我媽就要獨自面對他跟做所有的事情，現在我的工作型態是可以部分時間在家上班，所以家裡的事情我可以分擔不少。
如果我離開家，放我媽一個人在這個家我會覺得媽媽很孤單很可憐，還要做所有的事情，我真的不知道該怎麼做才好🥲🥲🥲
我媽也會一直覺得因為他是他兒子所以一直包容他
不管是大學的時候還是出社會，都因為家庭問題讓我很難過又苦惱，在外面都不能盡情的跟朋友好好放鬆
https://sticker-assets.dcard.tw/images/1588fef2-494a-486d-98e1-1f9b3ef8281d/orig.png",mood,2,,F,
13,Dcard,https://www.dcard.tw/f/talk/p/254295747,2023-12-31 14:25:30,ig上面嘴砲，遭到事主提告，加油事主，祝你提告成功！,"網路上真的很多嘴臭的人，看了原ig影片，在人家的貼文下秀下限，還把反駁自己的人全部人身攻擊、公然侮辱，還會叫同伴來嗆人，這種人真的需要法律制裁
留言區事主已經提告 加油 希望能成功",talk,0,huangtw14,M,海豹
14,Dcard,https://www.dcard.tw/f/talk/p/254295752,2023-12-31 14:25:54,今年紅白太強,"韓團全上
一起幫 YOASOBI 伴舞，
還有黑色餅乾跟口袋餅乾再度上紅白
猛

口袋餅乾片段
https://youtu.be/dV1ONM2o_fI?si=_zy6zuOmAhykKUDs

黑色餅乾片段
https://youtu.be/BJli23usT0k?si=h1FpKBOj35LrYls5
https://sticker-assets.dcard.tw/images/f36d3d45-406a-499f-a893-5aac28561550/full.png",talk,0,chandler0419,M,廢文是一種修行
15,Dcard,https://www.dcard.tw/f/talk/p/254295773,2023-12-31 14:27:34,經濟巨頭相關書籍,"有人看過類似巴菲特還是某某名人出的相關書籍學習後成功賺錢還是創業成功😧
可以留言分享一下嗎？",talk,1,c22231556,M,心靈雞湯
16,Dcard,https://www.dcard.tw/f/mood/p/254295806,2023-12-31 14:32:03,一輩子 一次只能喜歡 愛一個人,"為什麼人只能愛一個人
為什麼同時愛上兩個人
就要被視為出軌、劈腿
然後被社會道德觀念勒索

人生這麼長
會遇到那麼多的人
怎麼就能保證這個是自己唯一喜歡的
遇到後面的也很喜歡很愛的
也不是不愛現在的伴侶
同時愛著兩個人
兩個人也同時愛著自己
為什麼就不能同時擁有
人生已經夠累的了
為什麼人心還要這麼折磨
還要這麼痛

為什麼對的人
永遠都不會在對的時間遇到
為什麼總在付出所有以後
卻也沒能把握住自己的愛

為什麼有些人
分手後
沒辦法做朋友

為什麼
人生要這麼長",mood,1,,M,
17,Dcard,https://www.dcard.tw/f/mood/p/254295808,2023-12-31 14:32:12,台灣的未來，需要由你們的發聲而改變,"剛剛看了許柏的台灣草鴞影片，看見母鴞護著幼鴞的時候，我的眼淚真的止不住的掉下來

我真的覺得很誇張
那些自稱愛爸愛媽的人真的不要這麼自私雙標 

        貓平均一天要捕捉十到二十隻獵物才能生存下去，而目前記錄到貓的獵物至少有4000多種
        台灣的流浪貓大概有175600隻，假設平均一隻貓一天捕捉3隻獵物，按照這個數據推算，台灣一年至少有192,282,000隻動物死在流浪貓的爪下，流浪貓的命是命，難道其他野生動物的命不是命嗎？
        希望台灣政府不要再為了選票推一堆什麼友善貓狗政見了，麻煩你們拿著尺，衡量一下貓貓狗狗和台灣的生態多樣性那個比較重要，我相信不用多久，台灣一定又有一堆動物要絕跡了
YNR根本沒用，每年我走在路上都能看到一堆貓仔在跑，結紥的速度根本就趕不上牠們的繁殖速度好嗎！ 

那狗呢
        狗的活動範圍跟攻擊性很強，你看台灣流浪狗一年造成多少車禍和意外？
特生中心和林務局統計，整體野生動物被遊蕩犬攻擊數量，從2019年到2022年總計已達274隻，其中有128隻穿山甲、41隻台灣山羌遭遊蕩犬攻擊，而沒有統計到的還有更多。
        台灣大概有155800隻流浪狗，這些流浪狗也都是潛在的危險因子，像我家在新北，我家附近就至少有15隻流浪狗，每年至少都造成好幾起車禍，有時候出門還會被追，出門都要帶傘，不然有的狗甚至會貼到你的腳邊，每天都過得心驚膽戰的。 
-------------------------------------------------------
        我家在萬里，生態很好，所以有很多野生動物，有曾經有山羌跑進水餃店、猴子跑進公寓、果子狸過橋、飛鼠晚上在籃球場、國中旁的山有野兔、每年國慶能看見好幾百隻老鷹在飛、有人在廟附近拍到梅花鹿，小時候還看過兩次帝雉在吸杜鵑花蜜，隔了許多年我原本以為牠們可能消失了，但在今年中秋我在附近的山上採月桃葉要包粽子，聽到熟悉的叫聲，悄悄的走過去，看見一隻公帝雉的尾巴一閃而過，我還上網確認，我看見的真的是帝雉。 

希望十年後我還能在生活中，不經意的偶遇這些動物。我真的希望他們不要消失啊！！ 

我真的希望十年後我還能被窗外的白頭翁吵醒，我真的希望十年後我在黃昏回家的路上，能看見成群的藍鵲飛過
--------------------------‐----------------------------
流浪貓狗的命是命，台灣野生動物的命就不是命嗎？
我真的希望政府能推動野外零犬貓運動，希望政府在2024能有所作為。

不只有流浪貓狗的問題，路殺，友善農作，鳥網，陷阱……
有太多太多的問題我們需要去處理
或許我們現在找不到最完美的解決方案
但我希望大家集思廣益，找出可行的方法，哪怕只有幫到一點點，日積月累下也是會有成效的
-------------------------------------------------------
希望大家轉發這篇文章
雖然我只是一個十六歲的少年，但我也希望大家能夠重視這件問題
-------------------------------------------------------
許伯與簡芝。草鴞影片連結
https://youtu.be/LE8OAT5wveo?si=pvUOsiWFVcFYt2ck

萬里梅花鹿目擊連結
https://www.facebook.com/share/v/oMXA4WYKLm6L6XzK/?mibextid=xfxF2i",mood,1,,M,
18,Dcard,https://www.dcard.tw/f/talk/p/254292799,2023-12-31 06:48:47,2023年度總結,"歡迎大家一起回顧一下2023年🥰
-
我先開始：

1.今年最開心的事？
變得更加成熟獨立，能不被他人情緒輕易影響，能自由表達自己的想法，也終於能靠自己的力量賺錢（家教），身邊也有一群不錯的小夥伴們

2.今年最遺憾的事？
家人生病的時候自己不在身邊，只能在學校裡瞎操心這個那個

3.今年最後悔的事？
太沈迷於手機、網絡😅，隨便一滑都是半個小時起跳，時間都沒了，還感覺眼睛度數加深，啊啊啊啊啊根本戒不了

4.今年最感動的事？
在情緒低落的時候，總會有那麼幾個朋友能傾聽我的想法，不會像以前一樣總是陷入無限emo，身邊有人會給出意見、反饋，很溫馨

5.今年花錢最多的地方？
吃吃吃吃吃吃吃吃吃吃吃吃吃吃吃吃😋

6.今年最喜歡的一句話？
「我已經沒有興趣給每個人留下好印象了」
以前的我總是希望自己能做個圓滑的人
因為害怕起衝突
而時常焦慮、糾結和不安
真正到今年我才醒悟
做自己也很好（有限度的）

7.明年的三個目標？
健康減肥、認真唸書、天天開心

8.想對明年的自己說？
別著急，一切都好運都在路上！
（相信吸引力法則，只有在自己狀態最好的時候，身邊才會都是好事啊）

-
最後㊗️大家2024新年快樂！
願你年年有魚摸，歲歲躺平安😻",talk,0,carrie_0404,F,carrie_0404
19,Dcard,https://www.dcard.tw/f/talk/p/254292807,2023-12-31 06:49:57,夫妻總資產標準,"我跟老公皆36歲
年薪加總約90W
總存款300W（含股票）
總房貸-350w（一個月還款14k）
有台國產車（貸款還清）+機車一輛
兩人名下各有1房
兩間目前市價各是750w跟300w
（都有人住所以目前無法賣）
無後援所以沒小孩平常開銷算省
請問這種資產過生活大家會覺得很糟嗎？
是不是不適合生小孩?",talk,2,vkvk0036,F,放假開心捏
20,Dcard,https://www.dcard.tw/f/mood/p/254292759,2023-12-31 06:41:36,我媽很喜歡拿我跟我弟比較,"其實我真的不知道有什麼好比的
我當時讀國中的志願是美術班
而我弟的是私立資優班
我們兩個努力的方向跟內容都不一樣
我決定要考的時候就是比較專注在美術
但課業我也是兼顧（至少前四名
而他是開始不上安親班
改上數學家教英文家教國中理化班還有國文班
兩個人的專業根本不一樣
況且他也只是數理好 國英不好啊 但我跟他顛倒
我媽卻說我弟成績比我好
拜託一下好不好我們差了6歲
讀書的環境也不同
我當時讀的國小跟補習班都在鄉下
而且我弟都在大都市
我媽常常最愛說城鄉差距 這兩個地區的資源根本就不一樣 還那麼愛比",mood,2,,F,
21,Dcard,https://www.dcard.tw/f/talk/p/254292823,2023-12-31 06:52:43,真的該男女義務役,https://megapx-assets.dcard.tw/videos/76b33580-c115-4eb4-80e9-d36091e774c1/orig,talk,10,ken20030425,M,k
22,Dcard,https://www.dcard.tw/f/talk/p/254292826,2023-12-31 06:53:47,可憐的男友,辛苦工作的時候女友跟異性去夜店,talk,3,,M,國立交通大學
23,Dcard,https://www.dcard.tw/f/talk/p/254292842,2023-12-31 06:56:31,選舉車不要再吵了😡,"每次選舉快到了，相信很多人也要準備期末了，但總是一堆煩人的選舉車，其他地方有選舉車就算了，有的還一直開到學校附近，MD我半夜算完工數，腦袋都快炸了，早上要補眠結果還要聽選舉車在那邊吵，吵一次就算了，還有給我一天來四五次的選舉車，把請選舉車的錢省下來多發發衛生紙不好嗎，既有印象，也很實用


小提醒！
不管各位1／13號有多忙，請把握住自己的權利，記得出門投票",talk,3,,M,國立虎尾科技大學
24,Dcard,https://www.dcard.tw/f/talk/p/254292849,2023-12-31 06:57:09,請大家注意人身安全,此篇文章為轉貼文章，請更新至最新版本觀看完整內容。,talk,0,,F,實踐大學
