system_id,dataSource,artUrl,artDate,artTitle,artContent,boardID,commentCount,department,gender,school
256,Dcard,https://www.dcard.tw/f/talk/p/254297007,2023-12-31 17:00:26,給2024的我,"嘿嘿今年沒有忘記寫時空膠囊
先給自己一個讚👍
因為今年的最後一天很空閑輕鬆
在月中，在家整理新房間

生了糖心蛋了！當媽了！
真的好不真實喔！

希望到時候的妳沒有崩潰
沒有被一個人在家帶寶寶的生活逼瘋
或者是有順利回去工作賺錢？
還是準備做別的事情
不管妳選了什麼
都希望妳是快樂的❤️

和嘉豪結婚也一週年了！
他一直都對妳很好
希望會一直好下去
加油👌",talk,0,amrj0708_1030,F,花瓶也是美麗的
257,Dcard,https://www.dcard.tw/f/mood/p/254297004,2023-12-31 17:00:03,男生對生理期的體諒？,"如題：
本人生理期是會痛冒冷汗痛到吐的
上次在公司突然被月經攻擊 趴在位子上抖xwx
2位男同事知道後當著我的面說：哪有那麼誇張啊？感覺好做作…之類的
我聽到後真的很難過 uwu 
好奇是大部分的男生都有這種想法嗎
https://sticker-assets.dcard.tw/images/9d11f80a-02f1-4a72-a170-caed88d7cea2/orig.png",mood,2,,F,
258,Dcard,https://www.dcard.tw/f/mood/p/254296964,2023-12-31 16:53:30,新年快樂,"2023離去2024到來，祝福大家新年快樂
新年新願望都能達成～",mood,1,,F,
259,Dcard,https://www.dcard.tw/f/relationship/p/254296955,2023-12-31 16:52:40,新的一年想交朋友,要怎麼認識女生,relationship,0,,M,
260,Dcard,https://www.dcard.tw/f/mood/p/254296536,2023-12-31 16:03:46,跟一个不懂自己又很喜欢吵架的人在一起好累,"不管我们在说什么只要我说了什么永远都是那你呢
我实在不明白如果我每说什么都会说那你怎么不看看你自己
为什么要跟我在一起
所以我们就是两个很糟的人在浪费时间吗

你每次都说你会改你想了解我
可是每次情绪一来你还是坚持己见
什么都不懂
跟你解释你说懂了也什么都没改

每一次吵架
我就好像在法庭上一样
你每次都会翻变所有的历史
跟我细细地数着
我从我们认识的第一眼说过什么
做过什么
然后跟我说我现在要的不一定是我真的要的
因为我以前说过几次类似的话

那你跟你自己吵就好啦
你还需要我做什么解释呢
你什么都不需要啊
你到底是为了什么不放手啊

因为你是我的初恋所以我觉得很难割舍
可是你就是那种在一段感情钻牛角尖又不放手因为觉得是自己失败了

那我们现在还在一起真的跟因为是我有那么大的原因吗

我真的不懂我可以给你什么
真的好累
救救我
想不开
想不通

好烦

一直觉得他都那么努力了
害怕以后找不到第二个这么努力对我好的人
但是你真的好喜欢争
你什么都要讲到死
讲到我都死了你可能还是要讲

你从来在这种时候就不管我的死活
你就只固执的争，跟我辩，要求我服从你的想法
可是我也是一个很固执的人
你偏偏又这么硬的方式对我，我越不服从

我们到底在干什么
我已经不知道了",mood,2,,F,
261,Dcard,https://www.dcard.tw/f/relationship/p/254297315,2023-12-31 17:54:31,女友不幫我,無論是在家裡廁所或是在車上後座 女友感受到我硬了也都不幫我，大家的女友也都這樣嗎？,relationship,2,,M,
262,Dcard,https://www.dcard.tw/f/relationship/p/254297257,2023-12-31 17:45:51,我還在等你跟我說新年快樂噢,"說的就是你啦 可愛的寶貝學弟
期末加油ฅ^•ﻌ•^ฅ",relationship,0,,F,
263,Dcard,https://www.dcard.tw/f/talk/p/254297252,2023-12-31 17:44:49,請益,想請問大家有用過疏文 羅盤 煙供 之類的嗎 那個有效嗎,talk,0,yn_2001,F,熱愛K-pop的女紙
264,Dcard,https://www.dcard.tw/f/mood/p/254297259,2023-12-31 17:46:03,各位新年快樂哦,"雖然明天要上班 
但我還是衝去看跨年煙火
今年的有夠好看
超級驚艷
哦是某個夜市的煙火
不是101的
想卡各位的煙火照
(這是我錄影的截圖
哦然後因為我明天要上班 所以下班才會回來看哦
各位晚安 新年快樂
",mood,3,yujie_618,F,潔
265,Dcard,https://www.dcard.tw/f/mood/p/254297280,2023-12-31 17:49:19,滿腦子都是你,"好想問你
那天的吻代表什麼

我知道身份不允許
但忍不住就想抱抱你
在你懷裡時更是忍不住的偷親你

沒想到你會熱情的回應
接二連三的吻差點無法呼吸
加上用力摟著我的腰
閉上眼這場景一再的重現
隔天的輕吻也難以忘懷

只是當我勇敢向前時
你卻猶豫且後退了

你會願意等我嗎
當我處理好一切你就會跟我在一起嗎
能不能別再拉遠距離
讓我好好喜歡你",mood,0,,F,
266,Dcard,https://www.dcard.tw/f/relationship/p/254297275,2023-12-31 17:49:06,交友軟體 約砲之路,"今天想講點比較是需要努力的部分
簡單說；大部分人做不到的部分
曾經發布了幾篇文章都被說唬爛

與其在那吵架，不如講點實在的

1.長相
應該沒什麼能力改變
整形之類的因為我沒有整過
無法參與討論
本人也就是普帥而已
就稍微打扮一下 至少看起來不要太怪
2.身材
說真的，請好好運動
（可以的話看錢健壯
不管練什麼都好
有認真運動的人
散發的氣質就是不一樣
也會讓你各方面都相對穩定
舉凡血糖、情緒、思緒等等等

沈得住氣、有能力思辨、有能力處理
都會讓你散發更多魅力

3.興趣
有空就多培養更多興趣
興趣會讓你接觸到的人更多
你有機會接觸到各類型的人
也可以是一個話題性
但不能只停在話題性
他必須是一個你真的努力的內容

「認識更多人只是讓你學會各類型的邏輯」
並不是要你每個都在那邊噁心
那你最後只會臭名遠揚

4.自省能力
和對方過程中慢慢的去感受
可以在每次的對話後
都先停個幾分鐘自己看一下
對方的態度和狀態轉變
有哪些原因導致
轉好轉壞都要自己去好好檢視
如果不行 也能找朋友看一遍
可能有不同的想法跟角度
更能辨識出自己好與壞（盲點確認）

5.道德觀
最後一個是可能到一個程度才會在乎的東西
對方是什麼狀態才想跟你上床的？
如果是負面的狀態，建議不要
缺愛的、很無聊的、容易被騙的、想戀愛的
有婚姻、伴侶之類的應該就不用說了吧
因為後續問題都很多，你不知道對方會怎麼評價你

6.自信
這個不是直接培養的東西
也不是會天然生出來的東西
我只敢說 以上事情你熟練了

你在這方面就會很有自信
更甚至人生其他方面都會有自信

7.財富
如果做愛不是你人生的全貌
那請留一點讓你未來使用
如果你連約砲基本開銷都花不起
拜託你看完就好，不要想太多



「有幾分實力上幾分女/男人」
這世界永遠沒有真正的越級打怪
你這麼低分 成功的就是低分砲
每次的成功都不要太驕傲，都要做到自省
只有一直推到更高的層次
你才有充滿選擇的人生。",relationship,1,,M,
267,Dcard,https://www.dcard.tw/f/talk/p/254297267,2023-12-31 17:47:33,網購詐騙「誘簽金流服務」，「勿點不明連結🔗」認證❗️提高警覺、請打165,"轉刑事警察局反詐騙宣導：

聽到「ATM解除設定、簽署金流協定、帳戶認證」、等關鍵字🧐，請提高警覺❗️你可能遇到「假買家」❗️
若接到可疑電話或訊息，可向官方賣場查證或撥打(telephone)165反詐騙諮詢專線詢問！

#轉刑事警察局 #雲林縣警察局 #西螺分局關心您

https://youtu.be/BG4RCOy2d-A",talk,0,skll,F,雲林縣警察局西螺分局
268,Dcard,https://www.dcard.tw/f/relationship/p/254297232,2023-12-31 17:41:36,緣分,"緣分到底是怎麼樣ㄚ⋯⋯
以前偷偷喜歡一個男生，常常追蹤他的動態，某天看到他在暈船勒戒所留了一些很像分手的話
例如，有人發都交不到女朋友的文，他會在下面留言：這我（但他大學三年交三個）、標註朋友說「她真的好可愛⋯」感覺在說身邊的女生，很像那種剛認識覺得可愛的語氣（判斷他跟朋友的前後文得到的結論），還有一些其他留言都讓讓我更相信，他已經分手了。

下學期就剛好跟他選到同一堂通識課，我想說也太有緣了吧！還以為這就是緣分

結果他根本還跟他原本女友在一起，下學期要交換我也根本不可能再見到他😢😢
事實證明一切都是女人的腦補QQ…..

希望有一天也能遇到互相珍惜的另一半。",relationship,1,,F,
269,Dcard,https://www.dcard.tw/f/mood/p/254296308,2023-12-31 15:46:53,羨慕有正妹女友,"之前認識一個女生
她說她的正妹朋友的男友也是我們公司的工程師
ㄧ看ig是個2萬多人追蹤的網紅
讓同公司的我好羨慕
好歹我也180/70中分長的偏韓系
難道這就是所謂的緣分嗎？",mood,0,,M,
270,Dcard,https://www.dcard.tw/f/talk/p/254296968,2023-12-31 16:53:46,菊花的問題,"看過圖片都一樣，找資料也沒有明確的說法，我不懂明明都是菊花，那麼
daisy 跟 chrysanthemum 兩者差別在哪裡？

該不會一個更精確是指小菊花的意思，另一個就是不管是什麼樣子的菊花，就只是菊花！",talk,0,,M,輔仁大學
271,Dcard,https://www.dcard.tw/f/relationship/p/254297882,2023-12-31 21:28:49,想把妳留在2023,"從高中的追求，
到高二的告白，
妳說想等確定有大學再說⋯
好！我等
接著是高三的小曖昧，
我繼續等⋯
到大一的妳在雲林我在台中，
接著妳答應在一起的那天，
我嘴角沒有放下過！
突然間，我認為幸福的20天，
最後成為妳認為不是交往的20天⋯⋯
-
所有過程經歷了退出妳小帳摯友、小帳、大帳摯友
我都熬過來了⋯⋯
最後卻在妳認為回訊息有壓力、
不適合遠距的當下，
給了我最大的希望再無情丟掉
-
我退追也封鎖妳了，
現在也慢慢不要去一直想妳了
我想把妳留在2023
至少2023我追妳的部分不會後悔了
我真的很用力去追過妳了
該做好像都做了也還是留不住妳
-
2024
累了，
這次願望留給自己：
「好好愛自己與家人」",relationship,0,,M,
272,Dcard,https://www.dcard.tw/f/mood/p/254296873,2023-12-31 16:40:15,2024 新年快樂,"祝 在看這篇文章的各位，

新年快樂，心想事成，龍年行大運 

https://sticker-assets.dcard.tw/images/5a816438-918a-41af-bfc4-4acc0e564c28/orig.png",mood,0,,M,
273,Dcard,https://www.dcard.tw/f/mood/p/254296889,2023-12-31 16:42:22,對自己的外貌不太有自信,"我小學和國中都是被說醜的那位
除了主動追求都被打槍以外，還被霸凌
不過還是有被女生追過一次，但我不喜歡她

直到高中以後
多了一票女人緣，也被女生倒追
那時候很愛往外交朋友，是還沒有到打打殺殺的境界，也特別關注偏向弱勢的人，在那個群體中我算異類。畢竟被霸凌過，己所不欲勿施於人。
也帶過很多女生回家，但我那時實在太單純了就單純抱抱睡，就連我媽都在笑我。
可能是之前告白別人的陰影導致我不知道要如何跟女生相處

到了目前我還並不知道如何出手。雖然還是有女生主動認識我，但我一定會把話聊死🫠
首先，一定先誇讚我的外表和身高，雖然聽了很開心。
大概是這樣


但對於外貌，說是這樣說，但我對自己真的沒有什麼自信，可能是小時候的陰影影響太深，所以我歸類在我個人散發的獨特氣場🧲

最近應徵了男模、男公關
嗯，面試後就直接入取了@@叫我儘快上班
雖然都是變形的認同我
但是我自信度還是不夠，就很不知道我在堅持什麼
希望這份工作能讓我更有自信

不知道後續如何面對女客戶
抱著體驗人生的心態走一步算一步吧🥹
大不了不成功我還有原本的工作能做
薪水也不低",mood,0,,M,
274,Dcard,https://www.dcard.tw/f/relationship/p/254296872,2023-12-31 16:40:13,2023年給前女友的一封信,2023年過去了，今天我去做了推拿按摩，途中師傅問我的感情生活問我分手多久曾經跟妳交往多久，我回答交往了八年分手快兩年了，問我說怎麼不去把妳追回來，我回答說正因為我很瞭解妳我知道當妳說出口分手便絕對不會再回頭，當下我很希望自己是錯的，但我知道的妳一定很堅強吧，不管遇到怎樣的不順心或是再艱難的環境，妳總會找到出路知道自己當下該去做什麼，我明白自己沒有資格再過問妳的生活，但如果可以我希望妳在未來的日子遇到對的人，那個人不會是我，2024年開始希望自己可以放下一切也祝福妳未來的一切都安好可以很幸福..真的很幸福,relationship,0,,M,
275,Dcard,https://www.dcard.tw/f/relationship/p/254296867,2023-12-31 16:39:23,喜歡上不該喜歡的人,"2023尾聲，大家進入迎接新年的狂歡
而我深陷難過久久不能自己
希望真的有人可以給我意見

因為公事與一位男性偶有接觸 越走越近
年齡相差16歲
他是已婚的人，育有一子，住一起
與妻子長年分居達8.9年甚至更久，且不在同縣市
女方偶爾1.2個月會跟家人去男方家看小孩
他說 他提過離婚，但女方不肯

直到有一天，他向我表示對我的喜歡
我承認我也有，因他已婚 我的情感一直有控制住
我問了他 你會離婚嗎？
他說 沒辦法給我肯定的答案，因為這不是他單方可以決定的
同時他也害怕離婚 小孩監護權被女方搶走
他沒辦法給我承諾 沒辦法給我未來

這段時間我的心情真的很低落
長時間的相處 我已慢慢陷進去
我很喜歡他對我的好、對我的照顧 有一種被疼惜的感覺
我對天發誓 絕對不是看上他錢，否則我出去被車撞
且也沒發生過關係。

而我也知道 這份喜歡，是不符合道德的
無論他跟妻子關係如何 我如果繼續，就是一個第三者

我能期待他會離婚嗎？還是我應該趁現在砍斷一切⋯",relationship,3,,F,
276,Dcard,https://www.dcard.tw/f/mood/p/254297850,2023-12-31 21:03:16,被女友說不會舌吻,"滿心歡喜要跟女友迎接2024年
在前一晚想要跟女友歡愛一下
但被女友說你怎麼還不會接吻
我該怎麼辦?

我們遠距離再一起已經5年了
女友是我的初戀
磨合了很久
平常不怎麼吵架

但每每說到性事
女友對我幾乎都很失望
也嘗試用玩具
a片也追蹤了幾個
youtube教學也看了很多
有咪有那種在口腔內裝內視鏡的片?

他說舌頭要盡量把對方的弄過來，撩的方式
我試了
但她覺得我只是去撞他舌頭

但這種明明就是要實戰...
難道真的要找人來試嗎?
懇請指教....",mood,1,,F,
277,Dcard,https://www.dcard.tw/f/talk/p/254297828,2023-12-31 20:48:33,寫作能力是永遠立於不敗之地❗️,"雖然短影音是現在的趨勢，不代表寫作能力就要被拋棄！

因為不管圖片、影音、podcast等的腳本，都是建立在""文字基礎""上！

我在Dcard發表我對國民兩黨想法的文章，被一個1450瘋狂貼名嘴的影片，我把過去所有我寫過的文章全部貼上去，後來那位1450就消風了！並且我挑戰他寫篇自己的文章上來，不要一直貼名嘴的影片！

文字可以顯示一個人的內涵，而且可以深入且快速的讓人了解一個概念，而影音是需要打開喇叭才有辦法理解影片的內容。

寫作能力是永遠不會退流行的能力！
深夜有感！

黑暗需要陽光、負面需要正面！
所以我用N篇我對柯文哲正面的文章把1450給滅頂了！

唯①支持柯文哲吳欣盈、民眾黨請投⑫

小狐狸",talk,0,a0963099807,F,小狐狸
278,Dcard,https://www.dcard.tw/f/talk/p/254297817,2023-12-31 20:44:23,超便宜！！淡水團購社團！！歡迎加入～,"各位客人你們好呀～我們是多多比團購🛒，是位於淡水的團購店家，我們主要是團購一些生鮮食品、冷凍食品、零食、飲品、生活小物...的商品🎁，我們也會定期開放專門貼文詢問各位想要哪些類型的商品。

本店於2024/01/05開始正式營運✔️，在這之前也歡迎各位加入➕，本版主也有放一些商品可供各位先下單🛒。

取貨方式：
1.提供淡水指定地點面交👫（貨到付款）
2.提供網路寄送服務🌏（需要額外運費、提醒貨到後先行匯款和提供地址）

有任何問題都能➕斑斑好友，私訊斑斑，詢問斑斑～

謝謝各位的支持，希望未來都能提供給各位完美的服務和商品❤️

https://www.facebook.com/groups/721497882897228/?ref=share_group_link",talk,0,mimumu,M,斑斑
279,Dcard,https://www.dcard.tw/f/relationship/p/254297384,2023-12-31 18:10:08,交友軟體聊天,"大家在交友軟體都怎麼開頭？

還有都聊什麼話題呢？

想要認識人的那種

我有時候覺得我這樣正常的聊

對方會不會目的其實是約跑

感覺裡面的人都很快

可能兩個禮拜就開始聊色或約出去

但我真的做不到 對我來說好怪

最近難得找到一個興趣都很相同的

只是我有時候很少開（大概3天

回超慢 但她還是願意跟我聊

小感動 現在希望她趕快回我耶

然後新年快樂",relationship,1,,M,
280,Dcard,https://www.dcard.tw/f/talk/p/254297378,2023-12-31 18:09:05,人是善良的啦,持刀去跨年抱著什麼心態在過日子,talk,0,waron,M,雨勢滂薄
281,Dcard,https://www.dcard.tw/f/talk/p/254297354,2023-12-31 18:02:48,新北新莊🀄️,"新莊化成路🀄️缺一～
有人要來打ㄇ！",talk,1,,F,輔仁大學
282,Dcard,https://www.dcard.tw/f/relationship/p/254297347,2023-12-31 18:01:50,男友說謊騙我,"如果是你們會生氣難過嗎？
還是我管太緊了⋯？

大致上事情是這樣的

男友說
因爲怕我生氣
所以開車載女同事（非單獨）沒有主動報備
第一次知道事情之後
當時我跟男友談
至少告知一聲
我也不會阻止你不讓一群同事吃飯


後來
男友參加另一群的邀約
我主動問說有載女生嗎
他回我只載兩個男生
當下我也相信
過程中也報備說有哪些人


結果一個多月的今天在男友面前看到聊天紀錄
當天的邀約原來男友還有去女生家載其他女生
回程也單獨載女生回家


我直接問男友說當下我問你的時候為何不說
為什麼要說謊騙我
他也只是回我 怕我生氣
他也沒有做對不起我的事
不然你現在要怎麼樣 我自己決定


覺得去年的最後一天
和今年的第一天心情真的好糟糕….


男友開始對我說謊
我心裡真的過意不去
覺得好像離男友越來越遠⋯⋯


感情最基本的不是要互相信任嗎⋯⋯",relationship,3,,F,
283,Dcard,https://www.dcard.tw/f/mood/p/254297304,2023-12-31 17:52:47,失眠最終還是因為妳,"新的一年
然後還是emo
為什麼有另一半的人不一起閃？
沒有另一半的人想找這麼困難？

妳說小孩們給我造成困擾嗎？
並沒有一切的開頭都是妳離開
妳說妳一無所有？
但妳很自由沒責沒認
一切都丟給我...
說沒有要拋棄但妳這一切就是在拋棄
謝謝妳10年的陪伴
讓我往後人生只剩迷惘寂寞孤單
已上鎖的心如何在開啟
來說說新年新希望吧
希望今年的我能夠放下這樣拋棄我們的妳
笑這哭最痛
新年真的快樂嗎？",mood,0,,M,
284,Dcard,https://www.dcard.tw/f/mood/p/254297293,2023-12-31 17:50:49,東吳大學的跟蹤騷擾行為讓我感到很害怕,"這位東吳大學同學先是在我的一篇穿搭文章言語攻擊後，然後因為我不小心在淘寶買到一個假包後（我從來不買名牌並不清楚自己買了假的，也已經在文章中多次解釋並且道歉）
就一直瘋狂的攻擊我、追蹤我ig、在我很多文章底下留言騷擾我，讓我感到非常的害怕跟焦慮




跑去看我ig再來攻擊我



在我分享星巴克美食也留言


幾個月前已經回覆他提出警告

沒想到在最新文章又來留言攻擊騷擾我




我真心不理解這位東吳大學到底對我是有什麼深仇大恨要這樣一直在網上跟蹤騷擾我，我其實已經盡力不想讓這件事情影響我，但是在打出這篇文章我的手都已經害怕到在發抖。

你的行為讓我真的覺得你很可怕。我會繼續收集證據已幫助我提告。",mood,3,tea1234567,F,Miss布丁
285,Dcard,https://www.dcard.tw/f/mood/p/254297289,2023-12-31 17:50:20,拜託女性要好好保護自己的身體,"如題，近期有個名叫Harrison的外國男士，在泰國跟女性無套性行為染上HIV，但仍在亞洲到處跟各式各樣的女生發生繼續性行為散播病毒⋯

在日本京都短短89天就已經有23名女性跟他發生性行為了⋯傳播速度真的有夠快

近期這人已經到台灣了，影片上說已經在台灣待了一個禮拜多一些，所以到影片上架應該也待了兩個禮拜或更久，影片中也講到已經台灣的女生發生性關係了🥲

上來發文單純想讓更多的人，尤其是女生看見，希望大家都能保護好自己的身體，遠離性病🥲
㊗️各位身體健康 做好安全措施遠離性病👌🏼

ps.找不到跟新聞或時事相關的看板，只好選擇心情版了🥲
https://youtu.be/yd1YcKve7G8?si=32UlgUlgzQgd5Vc_",mood,1,,M,
286,Dcard,https://www.dcard.tw/f/talk/p/254297379,2023-12-31 18:09:16,芭比Q了🩸賴清德你的人格破產了‼️‼️,https://youtu.be/K_mvB-dLmhY?si=XcNyKm7H3az58Crt,talk,0,a0963099807,F,小狐狸
287,Dcard,https://www.dcard.tw/f/talk/p/254297332,2023-12-31 17:59:04,尋物-鑰匙 水湳公園,請問有人在水湳公園跨年會場撿到一個維尼熊的鑰匙圈，上面有三把鑰匙，有的話請私訊我🥹,talk,0,y54631,F,zt
288,Dcard,https://www.dcard.tw/f/talk/p/254297299,2023-12-31 17:51:41,星巴克員工請幫幫我,"我是星巴克夥伴
最近一直想不起來本日三句話到底是什麼
因為入職一段時間又不好意思問
可以請知道的夥伴幫我解答嗎
我真心感謝你🙏🏻",talk,0,ciny_01,F,環保小尖兵
289,Dcard,https://www.dcard.tw/f/relationship/p/254296323,2023-12-31 15:49:17,原來 真的會因為小孩沒辦法離婚,"以前總是不明白，為什麼常常可以聽到，「當年要不是為了小孩早就離婚的這種故事」。
直到自己遇到了，當小孩含著淚告訴你，不希望一家人分開時，心有多酸多痛…
沒有家暴、沒有第三者，在外人看起來幸福的一家四口，原來只是彼此在消磨愛的互相忍耐，好累好想放棄，可是2個小孩該怎麼辦？",relationship,3,sunny626017,F,米米
290,Dcard,https://www.dcard.tw/f/relationship/p/254297204,2023-12-31 17:34:35,我以為那是愛，結果只是被需要。,"大約兩年半前，我有一個交往12年的男朋友。
我們感情一直穩穩的沒有什麼不好，但是卻一直走不到婚姻的那一階段，我想也許是他從來都不積極過吧。無論是融入我的生活圈或是跟我家人相處他從來是抗拒的。
後來到現在我才想明白，交往期間我總是覺得不對勁的原因…因為我對他的愛讓他得到的太過容易了。
所以他一直習慣著我愛著他對他好對他的付出，從來都不覺得有什麼地方需要改變的。
而我一直以來都太累了，連提分手之後面對他自私的挽回都已經沒有力氣去心軟。

他說：「在高速公路上開著車的時候很想去死，因為這個世界上沒有人愛著我了。」
「你不愛我了要我怎麼辦。」

但我真的好累好累
可惜他不懂，一個人維持感情的感覺
我真的不想再過下去了。",relationship,1,,F,
291,Dcard,https://www.dcard.tw/f/talk/p/254297079,2023-12-31 17:13:07,原來國術也能打,"本來以為中國傳武除了八極拳還算好用之外
其餘的花拳繡腿太多，並不實用
沒想到還真有專攻中國傳武的人打敗練泰拳高手
看來我見識還太淺了QQ
https://tw.sports.yahoo.com/news/%E8%B8%A2%E6%8B%B3%E9%81%93-%E8%A9%A0%E6%98%A5%E6%93%8A%E6%95%97%E6%B3%B0%E6%8B%B3-%E9%BA%B5%E9%A4%A8%E5%BA%97%E9%95%B7%E9%99%B3%E5%BF%97%E6%99%83%E7%A8%B1%E9%9C%B8k1%E6%93%82%E8%87%BA-144307238.html",talk,0,,F,長庚大學
292,Dcard,https://www.dcard.tw/f/relationship/p/254297246,2023-12-31 17:44:23,1/1 00:10分手 ：）,"兩個人都還愛著 但因為一些錯綜複雜的原因
分手了 怎麼那麼痛 睡不著 
2024的開頭這樣要怎麼辦⋯⋯",relationship,4,,F,
293,Dcard,https://www.dcard.tw/f/mood/p/254297200,2023-12-31 17:34:06,雖然對跨年無感 但再回想去年後 心情真的好糟,"上禮拜剛分手
每天都夠糟了
跨完年後
沒想到可以痛苦到另一個境界
滿滿的都是後悔",mood,1,,M,
