system_id,dataSource,artUrl,artDate,artTitle,artContent,boardID,commentCount,department,gender,school
528,Dcard,https://www.dcard.tw/f/mood/p/254296859,2023-12-31 16:37:56,新年快樂,"新的一年來到，2023發生了意想不到的事
第一次愛這麼用力，第一次的失去
整個心都被掏空了
最近幾個月因工作的關係都差不多午夜十二點才會回到家
每天身心都很疲憊，而且兩眼無神

今天接待了好幾組是情侶的客人，他們看起來非常的幸福，應該也準備跨年要好好的聚在彼此的身邊

明明這幾天在藥物的控制之下，心情好很多，有些時候還很愉悅，下班騎腳踏車回家時，突然一股寂寞又不甘心的恨意湧上心頭

等我意識過來，我已經流滿了眼淚

朝著讓自己變得更好的方向努力了好一段時間，我也的確變得越來越好
雖然今天心情非常的難過，但難過沒有錯
明天太陽升起又是我努力奮鬥的開始",mood,0,,M,
529,Dcard,https://www.dcard.tw/f/relationship/p/254296825,2023-12-31 16:34:43,男友無時無刻都在玩手機,"是這樣的…..跟男友在一起四個多月了，剛在一起時，一起出去吃飯他都會和我聊天，漸漸久了他都只會滑手機，而且連我在跟他講話他都沒聽到的那種（超級入迷），假日偶爾會去他家過夜，也都只能乖乖待在旁邊看他玩手機…..還不能跟他講話..他會叫我先不要吵🙃菇菇莊園有這麼好玩嗎😖好不懂

單純想上來抱怨而已⋯⋯
各位也可以留言抱怨～這裡當大家的垃圾桶",relationship,2,,F,
530,Dcard,https://www.dcard.tw/f/mood/p/254297812,2023-12-31 20:40:40,我好像不能自私,"我知道你總是很忙碌
忙著處理好多好多的案件，忙著應付長官的要求
而我滿心期待要和你一起旅行的時候，調職通知又突然的來到
你總是滿懷歉意的對我說：「抱歉，這次可能又要取消了。」
我總是告訴你沒關係的，工作重要，我們還有很多時間可以一起旅行。

但我也好想要自私的說，你可不可以不要去，可不可以在我想你的時候陪著我
轄區菜市場的阿姨都比我常看到你，我好羨慕

知道你總是睡不飽，假日總是先讓你補眠
但你每次睡到打呼的時候，我都會在你旁邊偷哭
長這麼大還可以馬上秒睡打呼真的看起來好笨

其實我有時候好討厭你的工作，又忙又累又找不到人
偶爾也希望你可以學著偷懶一下，不要每天都當戰警，身邊甚至有人叫我勸你不要什麼都衝第一
但你總是告訴我這是你熱愛的工作
雖然好討厭，但閃閃發光的你總是讓我忍不住的微笑

你告訴我以後我們會有自己的小窩
會有我和你還有漂亮的小寶寶
我總是笑著跟你說，我會在你坐值班的時候帶小寶寶去好多地方玩
你也沒有反駁，只笑著跟我說記得安全第一，要玩的開心，要拍好多好多照片傳給你

好希望我能去你身邊，想要你抱抱我
但我知道我不能自私，只要我自私你就會更辛苦
但我真的好想你，可不可以任性一次就好",mood,0,,F,
531,Dcard,https://www.dcard.tw/f/mood/p/254297806,2023-12-31 20:35:22,政治狂熱仔閉嘴好嗎,"老實說我誰都不支持，你們要選誰關我屁事
我連投票都不想回去投

看到一堆 O 粉 (O 請帶入任意政黨、總統候選人）
惡言相向、互相攻擊
是覺得這樣可以幫忙拉到自己心目中候選人的選票嗎？
想想還覺得還挺逗趣的，到底是拉票還是反效果

我覺得更好笑的是都 2024 年了

多數台灣人還有那種英雄主義：

彷彿 OOO 選上，就能拯救大家
OOO 沒選上就是多數台灣人智力測驗失敗
真的可悲至極

好了網軍可以來攻擊我了
請把 OOO 帶入你支持的人",mood,1,,M,
532,Dcard,https://www.dcard.tw/f/relationship/p/254297805,2023-12-31 20:35:00,情侶一起玩遊戲的問題,"也不知道發這個版對不對，以下正文

最近在跟男友一起玩比較需要操作的RPG遊戲（他是老玩家，之前有玩過，我是第一次接觸這個

但自己真的屬於偏菜的那種，所以常常打一些比較難，沒辦法靠戰力平推的副本，就會開始受挫，然後就越玩越不開心

常常會一個副本重複打好幾遍，然後最主要都是因為我死太多次QQ

雖然也不是每天啦，大多時候都很享受跟男友在遊戲中相處的時光，可能開心跟不開心的佔比大概8：2

雖然男友沒有怪我的意思（但感覺他情緒有受影響，話變少了QQ）

而且有時候也會指導我說該怎麼打，但知道歸知道，真的開打後，腦子常常一片空白（可能就一次要注意三、四個以上的BOSS技能，再加上我自己操作也不熟，一不小心犯錯之後，就會開始連環錯）

所以，其實我也知道，問題最大出在我身上...

有時候任務都做得差不多的時候，他也會問說，其實我可以去打練習副本，多打幾次熟練就好了

但平常玩遊戲的時間，我也不想都拿來練這個，而且練一天兩天還好，每天都練，我覺得我真的會瘋掉

外加我對於玩遊戲的看法，一向就是輕鬆玩就好...所以死出來可能三次、四次，我就會有點喪氣的覺得乾脆算了，等戰力高在回來推就好

而且有沒有那些通關獎勵什麼的，其實對我來說無所謂，但又覺得這樣的我有點自私

（雖然是RPG遊戲，但我跟我男友玩的像單機遊戲似的，所以沒認識其他網友，不可能叫男友找其他人打副本）

所以想請問有一起玩遊戲的情侶，如果遇到類似的情況都是怎麼解決的？該跟男友好好談談嗎？會不會覺得我小題大作？

其實很想跟他討論...但又很怕他只會給我多練習就好、我想太多這種回答，但我真的覺得這不是我多練習就會的事，外加可能他的多練習->幾天，我的多練習->幾個月

如果我想跟我男友談，各位覺得該從哪個方面著手下去談比較好？

然後最後最後，我想問問，各位有玩遊戲的男生們，是不是真的比較在意“遊戲打的贏”勝過於“輕鬆玩，好玩就好”？

（抱歉問題很多，謝謝看到這裡的各位_(:3 」∠ )_",relationship,5,,F,
533,Dcard,https://www.dcard.tw/f/relationship/p/254297786,2023-12-31 20:21:50,同事這樣是喜歡我嗎？,"公司裡有一個很優秀的學長，平常都蠻熱心教導我工作上的知識，一開始覺得他對後輩都差不多，近幾個月可能剛好有一些共同話題，上班有空的時候聊不停，下班每天都會跟我訊息到很晚，沒有曖昧的文字，但就算句點也會再開話題那種，中午有時會找我一起吃飯，我感覺有些同事已經有一點奇怪的眼光了，有時為了避免異樣眼光我會避開他，然後就被他說我很冷漠…。

我其實有些困惑，因為我們兩個都各自有男女朋友，而且他感覺是感情道德感蠻重的人，但這些行為很像在曖昧，我又找不到證據。學長對我來說是難以高攀的人，異性緣也很好，不知道為什麼對我特別好，最讓我不解的是這些行為是單純把我當一般朋友還是有其他的情愫？我真的理解不能…",relationship,1,,F,
534,Dcard,https://www.dcard.tw/f/relationship/p/254297793,2023-12-31 20:29:07,其實我覺得天蠍系不太適合水瓶系,"原因如下：

1、天蠍喜歡觀察對方，可是，觀察得到的結論不一定正確，卻直接下了結論。

2、天蠍的佔有欲是那種不用說起來就可以感覺到的壓迫感，這樣讓敏銳的水瓶系很快的就感覺出來，雖然喜歡對方，會自動的保持距離，可也會開始過的不太開心，感覺到束縛感。
明明對方沒有明說🥲。

3、天蠍系可能有大男子大女子主義，短暫的時間點讓水瓶系妥協是可以的，但隨著時間增長，水瓶系會開始想逃跑。

4、天蠍系雖然真的對水瓶系非常吸引心動，可是，天蠍的疑神疑鬼以及若即若離真的極度勸退。水瓶系有時候很單純，會直接認為就是感情冷掉了，不被喜歡了，該準備離開了。

https://sticker-assets.dcard.tw/images/19f7d6e7-a36b-4ef6-af14-543dcc21ac1c/orig.png

水瓶系也許也吸引天蠍系，但也因為以上種種原因，會快速造成水瓶的冷卻勸退，因為水瓶不喜歡被疑神疑鬼。

水瓶系也不喜歡若即若離。

水瓶系也不喜歡被冷漠，還是需要保持溫暖的溫度，一旦讓水瓶冷下來就是冷了。

水瓶系也不喜歡直接被人下結論，有什麼想法自己思考過，需要去找水瓶確認，要說清楚只是這樣感覺但不一定正確，所以想直接跟你確認一下。

水瓶系雖然喜歡性感魅力，但天蠍的控制欲也是勸退。

目前就這些，有想到其他的再補充。

https://sticker-assets.dcard.tw/images/7f53cca4-4aaf-429a-8723-437e45e5946c/orig.png

重點：
這兩個星座要在一起前提條件就是要愛著對方，兩人都願意為了對方退一步，調整到兩個人都能接受的程度，這樣才有可能延續下去。",relationship,1,,F,
535,Dcard,https://www.dcard.tw/f/mood/p/254297928,2023-12-31 22:08:09,愛他就不要批評他,批評是在切斷他人悔改的後路。對方雖然聽不到我們在批評他，當他感受得到我們在批評他，因為能量說明一切，振動說明一切。愛他，就不要評判他，讓判斷歸零。要對每個人都有信心，他們都有自己的洞察力，讓他們內心的心光指導他們，不要試圖教導他們，那只是在干涉他人的課程，那只會讓他更迷惑、失去自信心。光已經勝利了，沒什麼好批評的。,mood,0,goldenwork2023,M,great world
536,Dcard,https://www.dcard.tw/f/mood/p/254297920,2023-12-31 22:00:41,東西買貴,"昨天去逛街買了一隻錶
最近很拮据，但是要送家人的
結果回家發現官網折扣便宜近1200$🥲
難過到現在還沒辦法睡
2023最後一天還被騙
就怪我自己沒做好功課，我還問櫃姐一次買兩隻有沒有折扣
她就淡淡的回我:沒有，很便宜了
而且官網是漂亮盒子
百貨就是一個軟塑膠盒裝著而已..
到底要怎麼調適心情。。",mood,2,,F,
537,Dcard,https://www.dcard.tw/f/relationship/p/254297781,2023-12-31 20:19:00,新年新願望,"大家的新年新願望是什麼呢
https://sticker-assets.dcard.tw/images/cda62da0-9ddd-4663-b23d-bc763ba09304/full.png
我先來！
希望我可以獲得最佳初戀
https://sticker-assets.dcard.tw/images/23d8bae0-7005-4110-b3f9-b25f1f896758/full.png",relationship,3,,F,
538,Dcard,https://www.dcard.tw/f/mood/p/254297839,2023-12-31 20:58:11,這是我見過繼特斯拉後 地球上最聰明的男人,"因為他造出了 我夢寐以求的禮物

https://youtu.be/lbVYVp0_H4M?si=zBjFnRA8FiR7JdhO
吉吉吉",mood,0,,F,
539,Dcard,https://www.dcard.tw/f/talk/p/254297133,2023-12-31 17:22:49,2024/1/1 海底撈西門店遊戲,,talk,2,cocomilk,F,嘟嚕嘟嚕
540,Dcard,https://www.dcard.tw/f/talk/p/254297176,2023-12-31 17:31:30,+,此篇文章為轉貼文章，請更新至最新版本觀看完整內容。,talk,0,kkk_6666,M,純愛愛戰士
541,Dcard,https://www.dcard.tw/f/talk/p/254298002,2023-12-31 23:15:08,徵求犀牛盾生日折扣碼,有人有不需要的犀牛盾生日禮金折扣碼嗎～可以用賴貼圖或主題換,talk,0,lorio,M,Kris
542,Dcard,https://www.dcard.tw/f/relationship/p/254295957,2023-12-31 14:55:02,水瓶男對一個人有好感會有什麼行為,想請問水瓶男們！你們對一個女生有好感/興趣時會有什麼舉動呢～,relationship,4,,F,
543,Dcard,https://www.dcard.tw/f/talk/p/254295978,2023-12-31 14:58:51,一月東京&迪士尼&精品佛系代購,"1月中會去東京和迪士尼，自己也會去買精品
如果有需要什麼東西的朋友 可以幫忙代購

下面是我有興趣一定會去買的

迪士尼40週年週邊，但不確定去了會不會有
還是要去看才會知道

軟糖盒子吊飾 超可愛

這個之前收得過 超級好吃

薯條三兄弟我也是百吃不膩

白色戀人我也是每次去日本必買

迪士尼扭蛋 聽說很便宜 但是是運氣的考驗

這個美白牙膏自己有用蝦皮買 私心覺得很好用
雖然網上有點貴 去日本開開有沒有便宜一點
牙齒真的變白很多


牙齒美白橡皮擦 我也大愛 
因為很常喝咖啡 牙齒容易黃
一用真的馬上見效



如果有需要再詢問我吧☺️",talk,0,,F,德明財經科技大學
544,Dcard,https://www.dcard.tw/f/mood/p/254295936,2023-12-31 14:52:58,新年快樂,"沒有什麼是必須的

一輩子至少要聽一次某某的演唱會

一輩子至少要談一場轟轟烈烈的戀愛

這件事你現在不做將來一定會後悔

被這些語言操縱你才會後悔

怎麼過都是你的人生

你的人生由你自己去定義

最重要的是讓自己快樂

沒有什麼事情是沒做你會後悔的

沒有什麼目標是你這輩子一定要達成的

沒有什麼地方是你非去不可的

什麼都會改變，什麼都會過去，不變的是你腦中快樂的記憶

所以相信自己、追尋自己的夢想吧

願你未來的人生事事如意、一帆風順

新年快樂",mood,0,,M,
545,Dcard,https://www.dcard.tw/f/relationship/p/254297996,2023-12-31 23:09:21,找住台南武聖、新永華這些夜市附近的人幫忙！有小小的報酬！,"對 就像上面文章說的那樣！


有問的話讓她看看這文章或是讓她加我IG的可以轉個500台幣請好心人吃個夜市
成功加到IG我可以請雙倍的！
主要是不想留遺憾！

不確定人的話可以加我上面IG拍照讓我看一下
要幫忙的話 留言說一下 加我IG 以免有多個人一起做

祝你們新年快樂！

PS(領500的話要加上面那個IG發個照片證明你有到過現場就好了 名額有限一個！）",relationship,0,ctf1028,M,秋天落的葉
546,Dcard,https://www.dcard.tw/f/mood/p/254297984,2023-12-31 23:01:36,無題,"晚上11點才下班
摸一摸弄一弄半夜2點躺床
約略在4點時睡著
但睡到一半醒來被滿滿的難過和好想死包圍
等一下早上10點就要起床準備上班

心好痛好窒息
這段時間一直有想要自殘的想法
好多難過的事情
以前都是靠著讀過的心靈雞湯讓自己強大
但現在只覺得為什麼要讓自己強大
好累好累

其實很多人在默默關注關心自己
有時候在社群平台發文時朋友會寫自己的心情和故事鼓勵
但很多時候我真的窒息的喘不過氣
好多事情好多委屈
就算講了也不會有人明白
什麼都不想講
怕被人發現自己的異狀所以也不能自殘
只能讓自己持續心痛難受喘不過氣
看哪天撐不下去了再說吧

反正這世界也沒有人真正懂我",mood,4,,F,
547,Dcard,https://www.dcard.tw/f/mood/p/254297979,2023-12-31 23:00:36,被詐騙了🥲,"如題，前陣子被詐騙了，雖然金額不大，約8000
以詐欺案來說是筆小錢，但還是好心痛

覺得詐騙集團都該死，利用人性去騙財
想也知道錢拿不回來了，一直在懊惱當時怎麼不多加確認，明明就有很多機會可以確認卻還是這麼草率的把錢給人家😔

當下匯款完馬上就知道是詐騙了，也打了165，但錢還是被領走了
看著網路上也有很多詐欺案，但台灣警察的辦案速度我實在覺得很失望⋯

現在睡前睡醒，反正只要是獨處的時候都會反覆想起當初被詐騙的情況，開始有點走不出來，好難過😔",mood,3,,F,
548,Dcard,https://www.dcard.tw/f/mood/p/254297986,2023-12-31 23:03:20,"尋人
昨天12／31在夢時代從下午一起等跨年演唱會表演，中間發生了事件而無法看到結束，聽家人說妳腳受傷，來此詢問，希望你無大礙",ps.是瑪爾主人,mood,0,,M,
549,Dcard,https://www.dcard.tw/f/talk/p/254297223,2023-12-31 17:39:44,眼鏡被壓壞....,"剛剛洗完澡眼鏡就順手放床上，但上床的時候忘記膝蓋就直接壓到眼鏡，結果變成了這樣....

這是三年前在寶島配的，鏡片有防藍光，整副配下來要5千多元，想請問有類似經驗的人，這樣還能修好嗎？或是可以只換鏡框？",talk,2,,F,國立臺北科技大學
550,Dcard,https://www.dcard.tw/f/talk/p/254297375,2023-12-31 18:08:03,三星s23u oppo10pro+,"想請問大家對於這兩款的手機建議
平常玩遊戲居多
拍照攝影毛小孩為主
追劇
線上急明早要送自己生日禮物
打擾到大家不好意思",talk,0,grass0101,F,大齡剩女
551,Dcard,https://www.dcard.tw/f/mood/p/254297290,2023-12-31 17:50:30,新年快樂,"祝一樣自己跨年的朋友們新年快樂
https://sticker-assets.dcard.tw/images/8517c300-81e1-4e93-a08f-25742d5738af/orig.png

快樂~",mood,0,,M,
552,Dcard,https://www.dcard.tw/f/mood/p/254297287,2023-12-31 17:50:08,如果我去彩虹版說我是北洋政府會怎樣,"
https://sticker-assets.dcard.tw/images/dc9fd2f0-7f7e-4942-8f8d-73109ce2cb42/full.png",mood,0,,F,
553,Dcard,https://www.dcard.tw/f/mood/p/254297212,2023-12-31 17:36:40,大家現在在公共場合還會戴口罩嗎還有人怕確診嗎,"如題 
已經沒在戴口罩了 +1

偶爾出門搭車還是會戴+2

怕沒戴確診+3

我超怕確診 怕會有後遺症",mood,2,,M,
554,Dcard,https://www.dcard.tw/f/mood/p/254297305,2023-12-31 17:52:47,喜歡的作家發政治立場文真的會突然冷掉🥲,"
不想帶風向所以碼掉了，在圈內也算小有名氣，之前真的很喜歡她的作品，結果突然講這麼一句直接冷掉
不否認真的會有粉絲因為喜歡的繪師投給誰就跟著投，但都是成年人了這種事情能自己思考吧🥲",mood,0,,F,
555,Dcard,https://www.dcard.tw/f/relationship/p/254297264,2023-12-31 17:47:10,精神出軌,"想問大家
在公司跟一個同事很好 他有女朋友
我對他算有意思吧 當然我沒有越界
他也知道我對他有意思然後對我很好 會關心我準備食物給我吃
朋友說他算精神出軌了
想問有嗎🥺",relationship,4,,F,
556,Dcard,https://www.dcard.tw/f/talk/p/254297249,2023-12-31 17:44:29,代購～,一月中會去香港玩 可以幫忙代購零食跟迪士尼的東西,talk,0,,F,逢甲大學
557,Dcard,https://www.dcard.tw/f/relationship/p/254297222,2023-12-31 17:39:41,可憐,"我表達能力不太好 請多多包涵🙇‍♀️

-
小女我目前23歲了，也有一個穩交兩年的男友
先說，我媽從以前就不太喜歡我去別人家過夜
她會覺得自己明明就有家，還有去住別人家也只會麻煩到別人
所以我跟男友是不能去住雙方家的！
但我太白目，還是有偷偷讓男友住過😖那當然也是有被發現過也被唸了（但現在都沒有再犯了！）
-
但男友很不明白為什麼都已經23歲了還要被管？
我也有問過家人也溝通過了，但他們的想法偏傳統，覺得女孩子去住男孩子家不好看
這方面真的已經好幾次差點要鬧家庭革命了🤦‍♀️
我跟男友時不時都會因為這件事搞得很不開心
這樣真的管很嚴嗎？我到底能怎麼辦@@？",relationship,9,,F,
558,Dcard,https://www.dcard.tw/f/relationship/p/254298008,2023-12-31 23:19:21,找女性朋友交友或閒聊,本人是處女男，無聊在版上徵可聊天或交朋友的女生，閒聊或是其它鎖碎的事都可以交流,relationship,1,jkoo,M,塚
559,Dcard,https://www.dcard.tw/f/mood/p/254297989,2023-12-31 23:04:09,現在來看，真的很警世,"現在叫做，爸媽幫忙令人羨幕
而且到現在也不知賺了多少
爲什麼你還是要跟台灣神話反著做呢？",mood,0,,F,
560,Dcard,https://www.dcard.tw/f/mood/p/254297969,2023-12-31 22:55:11,沒有傘的孩子,"如果可以我想成為有傘的人，我可以依靠別人嗎？可以不必自己承擔一切嗎？
新年快樂？對我來說年復一年，我的日子一成不變。",mood,1,,F,
561,Dcard,https://www.dcard.tw/f/relationship/p/254298015,2023-12-31 23:24:43,年底剛分手，想認真交往新對象,"26歲 新北人
175/71
國營事業員工 （年資2年）
年薪目前大約70左右
沒抽煙很少喝酒
平常的興趣：
打籃球🏀（也喜歡到體育館看職籃比賽）、看棒球 比賽⚾️。聽音樂 、追劇 、跑步
有興趣的話下面留言，謝謝大家",relationship,1,,M,
