system_id,dataSource,artUrl,artDate,artTitle,artContent,boardID,commentCount,department,gender,school
275,Dcard,https://www.dcard.tw/f/relationship/p/255936554,2024-06-24 04:04:04,一年多的曖昧終究是不清不楚的結束了,"前言：
我們是國中隔壁班同學，原本我們沒有很熟，只是互相認識的關係而已，但後來國三時因為學校辦了升學班的制度我們因而同班且變熟。

正文：
某次你在ig上發了一個便利貼，我沒帶著什麼心思的回覆了你一下，沒想到你竟然是因為心情不好才那樣發，害我一時之間不知道該怎麼辦，只好不斷的安慰你、希望能讓你心情好轉一點，當下其實也沒什麼太多的感覺，就覺得只是跟平常一樣關心一個好朋友而已，當天晚上，你莫名其妙的跟我說了句晚安你早點睡，我雖然想說？但也禮貌性的回了一下晚安。
沒想到，從那天開始你總是每天都要跟我說一句晚安才可以，也時常回覆我的限動或是便利貼，也會主動來找我聊天問我今天都發生了什麼，有人時常關心我，我覺得很開心，因為我是一個很喜歡分享生活和與人聊天的人，儘管那時的我只把你當朋友，但默默的我好像也習慣了這種被人關心的感覺。
約莫這樣子持續聊了三四個月左右，我們開始有更進一步的進展，也會說一些曖昧的話，我也習慣了有你在身旁陪著我，當遇到難過的事時總是想第一個去找你，你也會好好的安慰我，讓我感到被重視。可惜的是，當時正值會考時期，就算我們都很喜歡對方，我也沒有勇氣更進一步的發展了……因為我深知自己一定要好好的讀書，也有必須要考上的學校，緊張的氣氛讓我那段時間都感到壓力很大，我們之間雖然都還是很好的在進展，卻好像無法踏出那一步了。 之後，我們上了各自心儀的學校，我們為彼此感到開心，也有持續的在聯絡，可是卻沒有以前那麼多的熱情了，我還是習慣性的分享我的生活，你卻不是那麼認真的回覆我了，你的一舉一動讓我感到失望，我也試著告訴自己你一定是因為有什麼事要忙，所以無法好好的陪我聊天了，但你有事也不會說，只是安安靜靜的，我根本不了解你現在的生活，我無法接受這樣，於是我好好的正視了自己的感情，也許我也沒有跟之前一樣那麼的喜歡你了，於是我決定專心過著我也很忙碌的生活，我們還是會互傳晚安，但也僅止於此了，當你停下來時，我也不打算再追究再挽留了，距離我們完全沒說話已經過了一個月了，我打算就此停下了，把之前的一切都當作美夢，有時回憶一下就好了。
https://sticker-assets.dcard.tw/images/5f8874cf-6611-4ca6-8d29-38f9ac636ea5/orig.png
還是很謝謝願意花這麼長時間來愛我的你，有可能是價值觀不同，所以我無法認同你。",relationship,0,the_lurrr,F,LB
276,Dcard,https://www.dcard.tw/f/mood/p/255936661,2024-06-24 04:18:10,“透視人生的深刻規律。”,"大道無情才是蒼天有眼。
天地不仁正是人生考驗。

沒經歷過背叛，不足以談人生。
沒經歷過失戀，又何以談感情。

想成就高樓，就先把原來的地基打碎。

能遇到渣男，代表自己本身不夠圓滿。

識人、用人，交往的度，
是人一輩子的學問。

想要活的通透，
就要看清社會規律。

自己不打碎自己，這個社會有的是機會欺負你。

擊碎你，是為了重建你，與其怨天尤人，不如重生自己。

你是什​​麼你就吸引什麼，
花香蝶自來，肉臭引蒼蠅。

在無人問津的地方，千錘百煉，摸索竅門，整合經驗。

在有人矚目的地方，躍躍欲試，披荊斬棘，閃亮登場。

風光背後，都是滄桑，
人前顯貴，人後必定受罪。

難度和反人性，
是區分人與人唯一的障礙。

一個人之前的失敗，
能找到自己的反義詞，
就是成功。

種什麼因，得什麼果。
想要什麼果，就去種什麼因。

想看花，要先澆水，
想得財，要先富心。

想要好的情人和生活，
先讓自己配得。

世上沒有什麼事與願違，
所有的事與願違，都是因為你本來就沒有準備好。

帶著缺陷和劣性前進，當然會收到上帝安排給你的各種不滿意和打磨。

天不語，以相示人。

天福人，先以微禍儆之。

有些人就是要跳出來才能看清，有些事就是要盡全力才能完成。

有時候要逼自己走絕路，無退路。

有時候又要懂得彎道超車，棄卒保車。

總之，要有智慧分清，要有兩個想法同時存在。

不遭天磨非好漢，
雷霆雨露，俱是天恩。
逢魔遇佛，皆為度化。
先完整自己，後較量世界。

手段可以黑，發心必須白。
只要你能堅定達濟天下，
何必執著於獨善其身。",mood,0,hz52_j,F,只想靜靜🤡
277,Dcard,https://www.dcard.tw/f/mood/p/255936509,2024-06-24 03:58:33,#舒發文 坐月子對我來說是一種痛苦,"從8號到今天，寶寶離開第17天了，坐月子對我來說變成一種煎熬跟折磨，有時吃著月子餐 邊吃邊流淚，很想趕快可以出門去散心，每天的胡思亂想，每天的思念，每天的流淚，真的覺得心好累…
只能一直看手機一直看，盡量讓自己不去回想，但是..好難
恨不得當時為什麼不乾脆跟著一起走了
需要多久時間，才能釋懷才能放下！
一直在想，我是不是 會不會生病了，但是面對家人又要堅強跟壓抑，真的很煩",mood,1,qwe77129,F,我會享妳
278,Dcard,https://www.dcard.tw/f/talk/p/255936283,2024-06-24 03:22:27,#分享 #KPOP 台北信義區KPOP舞蹈教室,"不知道要發在哪個版XD 
決定用閒聊的方式分享最近體驗的KPOP舞蹈教室


比較特別的是我選了一個非常小眾的教室 （因為個性太內向，偏好小班制）
選曲和台北的大教室都很類似，這部分完全不用擔心
https://sticker-assets.dcard.tw/images/399247ef-4253-4850-a784-d57335fb319e/orig.png

除此之外，還有開放單堂體驗，所以我就先報名了第一堂課
這堂選曲是雨琦的Freak （奶味藍最高！！）

老實說自己去最害怕結束後被推銷，但完全沒有><
加上小班制的關係，老師很仔細地帶動作，班上年齡層很廣泛（從國小到上班族都有）
上完第一堂我就報名一整期了，聽說最後還有成果發表影片，算是給自己一個新的突破吧！

附上教室環境照～～以舞蹈教室來說算是很有風格了哈哈

",talk,0,,F,國立臺灣師範大學
279,Dcard,https://www.dcard.tw/f/relationship/p/255936491,2024-06-24 03:55:55,男朋友玩交友軟體,"發現男朋友剛在一起一個月就有下載交友軟體
而且換上了我幫他拍的照片 看到的時候覺得晴天霹靂
有match到人聊天 但沒有約出來
他承認是一時興起才下載 有跟人聊一下 但沒有約出來
而且即日刪除了就沒有再玩
承諾我以後一定不會 一直求我不要分手 
我有分手的念頭 但又捨不得
應該怎麼做？",relationship,1,,F,
280,Dcard,https://www.dcard.tw/f/mood/p/255936273,2024-06-24 03:20:56,憂鬱症最嚴重的時候,想問大家憂鬱症最嚴重的時候是什麼狀況？本人目前每天都處在焦慮、低落中，對各種事情都失去了興趣，這算很嚴重嗎？,mood,0,,M,
281,Dcard,https://www.dcard.tw/f/talk/p/255937167,2024-06-24 05:22:07,臉書登不進,,talk,0,appgood,F,raccoon
282,Dcard,https://www.dcard.tw/f/mood/p/255936173,2024-06-24 03:03:09,有人跟我一樣裸辭在家當家庭主婦嗎？,"在這職場已經半年了

一直想離開這個職場思考很久，畢竟公司來來去去太多人，都沒人可以做很久

我遇到的是主管對我的騷擾（亂摸）

終於把這件事告訴老公，一開始怕說了會影響到夫妻之間的感情

怕另一半誤會我不想工作之類….

最近另一半看我都不說話，總是沒有心情沒有笑容

一直問我怎麼了⋯⋯公司是不是發生什麼事，我一直都說沒事，對他說謊我很好之類….

昨天想到星期一還要回去上班，心情莫名低落，昨天忍不住終於….

事情經過跟我另一半說

原先我以為另一半聽到會覺得我騙他之類

結果他說他要幫我處理…他想知道我到底在公司發生什麼事，導致我最近都這樣悶悶不樂

因為沒證據無法讓對方承認我有被性騷擾

另一半就說：妳把工作辭了吧⋯⋯在家把家顧好，至於工作慢慢找吧

其實我不該把這件事放在心裡，只是我怕說了會破壞到這份感情

今天早上我果斷跟主管說家裡有事暫時無法上班

他還是要挽留我，但面對他我就無法踏進公司⋯⋯

現在的我心情放開，好好照顧家裡小孩，工作慢慢找….

我很開心我離開那裡…..不用被當廉價勞工，更不用被佔便宜

是否妳們也有遇過這樣的事情呢？",mood,1,,F,
283,Dcard,https://www.dcard.tw/f/relationship/p/255936122,2024-06-24 02:54:34,想知道各位辦婚禮有省略儀式嗎？例如文定、迎娶及過門,"最近跟男友在準備結婚

男友媽得知我們要結婚，就開始滔滔不絕地分享她自己的經驗（都是30多年前的事情）
我們想說反正就一邊陪她聊天一邊當作參考。

結果講一講，男友媽重點只是在叫我們結婚要省錢的辦，能省略的就省略，
說她什麼也不要求，也不需要女方嫁妝（推論是她自己也拿不出聘金）
還提議要辦戶外婚禮，講得好像多浪漫，結尾她補一句：哎呀辦這種的比較省錢啦！

然後所有的儀式（文定、迎娶、過門）都會省略。我不知道省略這個部份會省多少錢？

我一生一次的婚禮，她卻只想著要精省，男友跟我說聽聽就好，反正她也沒有要出什麼錢。",relationship,7,,F,
284,Dcard,https://www.dcard.tw/f/relationship/p/255936401,2024-06-24 03:40:05,感受不到愛該分手嗎,"-
跟男友在一起一年多，
男友在一起前就表示自己不浪漫！
所以基本上除了生日不過節沒有任何儀式感.

我也認為這是個人喜歡的問題，
但最近不在感受到被愛了🥲

感受起來自己像是玩具一樣，
男友開心時我們都很甜蜜很好，
當他不爽我就變成空氣也會叫我滾，
就算兩個都有錯的時候，我也會主動道歉！
：好啦對不起不要生氣我請你吃晚餐啦
：知道錯了～不要不開心了
大致上這樣的去哄他！（一人一半錯的時候‼️

但當今天角色互換時男友絕對不會哄，
甚至可以跟我冷戰好幾天～
把我當空氣的那種！
（我們同居
吃飯、出門、上下班、睡覺都做自己的
完全把我當透明人🫥

這陣子也有嘗試跟他談過，
：我覺得我好像不在感受到你愛我了！
：我也覺得你不在像是以前在乎我的感受了！
他卻沒有回答任何只是翻過身繼續睡覺🥲😭

很不喜歡不堅定的感情，
我是一個喜歡穩定細水長流的人～
但感受不到愛了真的好難努力
是我太敏感想太多了嗎😭

https://sticker-assets.dcard.tw/images/446039c1-1674-46b2-8e31-d7edb769a702/full.png",relationship,3,,F,
285,Dcard,https://www.dcard.tw/f/mood/p/255936258,2024-06-24 03:18:33,怎麼接受自己長得普,"好羨慕大學室友有很多追求者…
平均每個月都被告白2次

自己看自己通常不大準
只能從別人的角度看…

1.在路上從來沒有被搭訕過
2.男生朋友幫我取過一個綽號叫普妹（？
3.男生好朋友跟我說：
我就算去南韓回來也不會喜歡上我（？
重點是我也沒有喜歡他…
4.高中遊戲輸告白 男生沒有喜歡我但也沒有嫌我
5.大學曾主動告白兩個男生
兩個都分手了💔
一個跟我說一開始沒有喜歡但後面有喜歡
（是因為男方控制欲太強我主動提的…）
另一個分手後跟我坦白其實沒有喜歡我…
他應該只是想交女朋友…

曾經被告白過3次（1次是學校外籍生）
除了外籍生覺得我漂亮外（？
其他都是因為相處久了日久生情

個性上沒有什麼太大的問題
應該是個性反而成為特色吧…
如果沒辦法長得好看一點
大概就只能想辦法讓自己接受…
我自己是沒特別對自己長相有什麼不滿啦
反正就是這樣也不會特別想整型那些
該怎麼讓自己接受自己在別人眼裡很普的事實（？

因為實在是太普了…
就不放照片了請見諒…",mood,0,,F,
286,Dcard,https://www.dcard.tw/f/talk/p/255936364,2024-06-24 03:32:50,畢業證書的英文名字,"想請問大家，我的姓氏是「朱」，該用Z（漢語拼音）還是J（通用拼音）呢？謝謝大家
",talk,1,c____uyyyyy,F,kkkkkkkk
287,Dcard,https://www.dcard.tw/f/relationship/p/255936153,2024-06-24 03:00:05,為甚麼我會交不到女朋友?,"最近大家都在談論PR值
但我只想知道我還有哪裡需要改進，或是再增進自己
才有機會交到女朋友?

先簡單介紹下我本人

年紀：29歲

身高：171

體重：66

職業：早上在家裡麵攤做生意、晚上無聊就跑UBER EATS兼職

月收：約6萬 存款目前80上下 加上股票約10萬

資產：一棟透天（家裡的）、一台雷霆125

長相：方臉、蒜頭塌鼻、單眼皮、小眼睛、薄唇、皮膚偏黃黑，但沒痘痘還算乾淨，額頭有點高

家庭：爸、媽、我、我妹加一隻狗，爸媽原本經營麵攤，現在退休換我接手，妹妹在外商 
公司上班，長期不在家，狗狗是一隻大黑狗名叫多多，在我們家騙吃騙喝已經10年了

感情史：母胎單，曾經跟女生告白過，被打槍過，被嫌醜過，啥奇怪的理由都有

放假娛樂：打英雄聯盟、看動漫、打籃球

一些自我介紹：
INTJ，天蠍座，O型，不太會穿搭，上班就是一件T恤加短褲，也沒什麼物慾，很好養，不敢吃黃瓜跟芹菜，卻還是每天都要切😅沒事的時候喜歡看動漫，最近在補排球少年，英雄聯盟是打上路跟打野，MAIN辛吉德跟薩科，打籃球是朋友揪有時間才會去
在人際關係上因為之前是讀男校，講話就蠻直接的，比較少跟女生接觸，在麵攤上班是跟女生講最多話的時候，我在想會不會也是這個原因讓我在感情路上處處卡關?

已經要30歲了，還是沒有什麼女人緣
我在想是我自己的條件不夠好? 還是我的個性問題? 
希望網友們可以為我解答（或是鞭打小力一點

祭品 多多
",relationship,9,,M,靜宜大學
288,Dcard,https://www.dcard.tw/f/relationship/p/255936385,2024-06-24 03:37:11,童年陰影真的會影響到後來的每一次戀愛,"小女今年剛滿26 金牛 
以及少的可憐的兩段感情
除了前任 就是交往不久的現任

其實我在感情裡十分鑽牛角尖
總是咄咄逼人 壓的別人喘不過氣
真的就是連我自己都受不了那樣的自己
強勢 高傲 永遠低氣壓 冷暴力 吵架的時候總想贏
認不得一點輸

這個情況 直到遇到現任後發生改變
雖然還是很金牛 一吵架就想沈默不說話
但因為另一半真的受不了我的沈默 
所以總是有種被強制營業的抓起來陪她吵架的感覺
否則不說話的我在我另一半眼裡我就是冷暴力
關於這點真的很無奈
誰懂金牛一不開心就不想說話的本性阿😩

慢慢的 一次一次的學會吵架的時候去表達自己的感覺
為什麼我總是躲起來沈默不語呢 我大概總結出幾點

1.個性問題 過去二十幾年都是如此 一下子真的改不過來
2.我對象真的太能言善辯 邏輯清晰 講真的我說不過她
3.因為吵過太多次一樣的事 但最後都無疾而終 潛意識裡覺得無論我說多少遍 你不信還是不信 說了跟沒說一樣
4.這是我昨天腦袋裡突然出現的很重要的訊息 我覺得我被我的童年陰影深深的影響成了個有情感障礙的人

回歸上題
過去我一直覺得自己可能受星座或個性影響
所以總會給自己加標籤 🏷️
覺得金牛人可能真的就是這樣 悶悶的 內心劇場超多
喜歡反反覆覆推開一個人來確定對方愛我
甚至心口不一 明明心裡就不是這樣想的 還是要嘴硬
還是低不了頭 還是強勢的不肯認輸

直到最近頻繁的和另一半爭吵後 
我開始正視我內心的感覺
上面說過 我的另一半是個極冷靜的人 邏輯很清晰 言語也很犀利 常常抓住一個點不放 逼著我要正面回答

就是這種感覺 讓我在一瞬間回到我小學的時候
我終於能夠明白自己為什麼總是逃避問題

⚠️這裡提一下 我小學的時候被班導霸凌過
我小時候是極度不愛讀書的人 甚至也常常不寫功課
可以說是老師的眼中釘 
她常說門口那麼多罰站的男生裡就站著你一個女生
你都不會覺得自己很沒臉皮嗎？

事件一：她曾經因聽信班級好學生的說辭
從而懷疑我偷拿同學的五塊錢
不分青紅皂白然後當著全班同學的面扇過我一巴掌

這裡感慨一下不愛讀書的孩子有時候真的很容易被人刻板印象覺得連帶人品都很差 我只想說 老娘是不愛讀書而已好嗎

事件二：她曾當著所有教師的面把我拖到樓梯底下的小黑屋門口
嚇唬我裡面是專門關老鼠的地方要把我丟進去
大概那樣的鏡頭永遠都不會忘
我現在偶爾還能夠想起我面前站著許許多多的老師
每一個人都議論紛紛說怎麼會有這樣惡劣的女孩子？

我真的永遠忘不了小學班導永遠居高臨下質問我的神情跟口氣
那樣咄咄逼人那樣尖酸刻薄那樣看不起我

我覺得這樣的陰影其實伴隨我很多很多年
只是我自己一直都不自知
直到最近 我才慢慢發覺另一半在質問我的時候
我彷彿像做錯的事的學生 難堪到不行的這種感覺
一下子就拉回了十幾年前坐在樓梯上的那個無助的我

直到這一刻 我才發現 
原來我一直沒有從十幾年前的樓梯上走下來過
原來這麼多年我談的感情會失敗
其實跟我的童年有很大的關係 

這導致我後來在感情裡習慣性沉默
因為常常會有一種反正我說了你也不會信的感覺
對 反正我說我沒有偷錢 我的老師也不會信

我不知道這算不算是另類的情感障礙
但我好像會過度保護自己
一旦受到一點風吹草動 我就會下意識的躲起來
甚至自卑到在感情裡常常打退堂鼓
怕自己不好 怕配不上別人

談戀愛的時候只要感覺到對方不耐煩或者沒那麼愛了
就會害怕的想要立刻馬上縮回來 

有時候真的很想和梁靜茹借點勇氣
很想要在吵架的時候 勇敢的抱住我的另一半
告訴她 我其實很愛她

但是有些話真的就是卡在喉嚨裡怎麼都說不出來
我討厭這樣膽小鬼的自己
或許這樣的個性會使我再一次失去這段感情
但我真的好想要有人可以看到我的努力

看到我明明不擅長 但還是想要愛你的我",relationship,1,,F,
289,Dcard,https://www.dcard.tw/f/talk/p/255936223,2024-06-24 03:12:46,有冷氣的地方就是讚!,"天氣太熱，就是要去百貨商場吹冷氣:)!
不想一直曬太陽 決定到勤美誠品去享受一下免費冷氣~~~
結果就在二樓轉角遇到超多卡通周邊的快閃店~
誠品文具館最近也有進很多可愛的小東西
但都偏貴就有點下不了手．．．
旁邊的貴貴鞋也好美啊~
總之最後就是在這間快閃店花了錢 買了一隻百變怪玩偶娛樂自己
分享一下內心戲的部分..



(這面鏡子看起來隨時要倒…


(百變怪在後面到底在麻木什麼..超好笑


(這奸詐的笑臉怎麼有點可愛哈哈哈

快閃只到6月底~ 現場逛一輪 也有到他們粉專參加活動，出示給店員可以現折30塊的活動！！每週都不一樣的活動～
他們的粉專: 
https://www.facebook.com/WAYTOFUN.TW
 
p.s 誠品冷氣真的不是很涼… 
#台中 #勤美 #百變怪好可愛",talk,0,,F,國立臺北商業大學
290,Dcard,https://www.dcard.tw/f/talk/p/255936311,2024-06-24 03:25:44,徵人～泳渡日月潭,"9/15（日）泳渡日月潭
目前有兩人
都是屏東開車自行前往

當天在日月潭一起集合拿物資
交通、食宿、都是自行處理
泳渡的話因為大家速度不一樣
也是分開自己游～
看看有沒有人要++

https://sticker-assets.dcard.tw/images/1bbd27e4-2680-475a-9028-890d11ac506c/orig.png",talk,0,atoztooeasy,F,A to Z
291,Dcard,https://www.dcard.tw/f/relationship/p/255936371,2024-06-24 03:34:27,好討厭我爸媽一直把我當成小朋友看待⋯,我今天都快17了 我感覺我父母還是一直把我當小朋友看待 尤其是我媽 我時候我想去哪裡我媽都會說我載你去 但這時候我都會說不用 我又不是小朋友我自己去就好 我真的超級討厭我媽這種行為 有種過度保護的感覺⋯但我有在想另有一種可能是因為我現在在學校住宿只有假日才回來 所以是不是他們才這樣一直跟著我⋯,relationship,2,,F,
292,Dcard,https://www.dcard.tw/f/talk/p/255936277,2024-06-24 03:21:26,有病就要好好看醫生,"黃斑部病變惹

我的黃斑部因為血管滲漏造成水腫
但聽醫生解釋感覺不嚴重
說大部分的人治療後會復原

現在就是先吃藥 然後再回診照眼睛血管攝影
看看要不要打針

應該是這樣ㄅ
太想睡覺有點沒在認真聽醫生說什麼

ㄚ大家壓力不要太大跟好好睡覺ㄛ",talk,1,tzzzzzzz,F,Tz
293,Dcard,https://www.dcard.tw/f/mood/p/255936305,2024-06-24 03:25:05,夢境出軌,"一直夢到男友出軌，每次醒來都很難過，為什麼會這樣
https://sticker-assets.dcard.tw/images/1588fef2-494a-486d-98e1-1f9b3ef8281d/orig.png",mood,0,,F,
294,Dcard,https://www.dcard.tw/f/relationship/p/255936237,2024-06-24 03:15:32,台北交朋友,🦭 25歲，在台北沒什麼朋友，希望可以跟在台北的朋友認識一下交個朋友🥹 如果聊得不錯很投機的話希望之後也可以約出去咖啡廳、吃飯、逛街、出去玩、一起聊心事等等的🥹,relationship,0,,M,
295,Dcard,https://www.dcard.tw/f/talk/p/255936164,2024-06-24 03:01:59,珍惜特別像這樣的朋友🤪🤪,https://megapx-assets.dcard.tw/videos/c34e4518-c470-4b51-9e93-13dec3f07f53/orig,talk,0,william315,M,創業這檔事朱爸
296,Dcard,https://www.dcard.tw/f/mood/p/255936758,2024-06-24 04:29:46,楊森,,mood,0,weisengift,M,john
297,Dcard,https://www.dcard.tw/f/talk/p/255936559,2024-06-24 04:04:35,"暑期講座《前進AI影像革命
》歡迎報名‼️","前進AI影像革命

MOOVINS 獨家課程，閃耀全亞洲！

Hi！大家好！MOOVINS 為全亞洲首創，攜手美國 3D 動畫大師 Michal Makarewicz 和來自迪士尼、皮克斯、夢工廠的專家們，帶來最炫酷的尖端學習課程！

我們是一群熱愛「美學與科技教育」的「國際師資」團隊，適合所有年齡層的朋友們。

🎬《線上名師動畫講座暨師資培訓》

來自皮克斯、迪士尼、夢工廠的國際動畫大師們，將分享寶貴的業界經驗和製作秘辛！還有 15 小時的預約制動畫教育師資培訓，一起成為動畫教育者吧！

💡《3D角色動畫精進課程》與《3D燈光渲染精進課程》

無論你是初學者還是動畫高手，這個暑假，每個週六都來和今年最火的動畫電影「八戒」製作團隊 ""CHEER Digiart"" 一起，讓你的動畫技術突破天際！

🌟《國際動畫大師講座》

想了解國際動畫產業趨勢，或者皮克斯動畫師們的日常？絕對不能錯過 Michal Makarewicz 帶來的大師講座，深入解析 AI 時代的影像革命，揭露國際動畫團隊的工作內幕！

---

👶🧒 我們啟發「兒童青少年」的觀察力與想像力！探索未來！

😆《兒童青少年3D動畫教育》

大師課程即將在暑假開跑啦！特邀動畫名師 Michal Makarewicz 親自授課，為 10-18 歲孩子們量身打造主題課程，帶他們進入創意無限的動畫世界！

趕緊來報名吧！也歡迎加入官方LINE與我們聊聊 ！

⭐更多資訊請洽:
https://www.moovins.org/",talk,0,kneinni1234,F,😀
298,Dcard,https://www.dcard.tw/f/mood/p/255936292,2024-06-24 03:23:43,朋友拿我的生辰八字去算命,"有天跟朋友聊天聊到一半，他很突然的問我幾點出生的，當時雖然疑惑一下，問他要幹嘛，他說要幫我看下降星座，當時很好奇沒想那麼多就給了，還討論了有的沒的，反正後來我也忘了這回事，直到最近他突然打電話跟我說，他拿去算他跟我適不適合，當下跟他聊天我沒什麼想法，就很好奇結果是什麼而已，後來過了一陣子後，自己越想越不對，越來越害怕，他怎麼能沒經過我的同意就去算，就突然好想打電話過去質問他，但過一段時間了再加上不知道怎麼開口，所以一直沒講，可是不講感覺不對，應該怎麼開口才對啊啊啊，雖然目前沒發生什麼事，但我現在就是好慌啊！！！！！

請問這樣會有什麼影響或後果嗎，或者我要小心什麼嗎？我現在在到處爬文，幾乎都說不要亂給生辰八字🥲
https://sticker-assets.dcard.tw/images/a598eaf1-4a79-4eac-9602-88945fbb577b/orig.png
以後真的不敢再給別人生辰八字，現在想想下降星座自己也能查，我到底在白癡什麼…
https://sticker-assets.dcard.tw/images/d93e9c82-4969-4e74-828d-39c5f28c56c6/orig.png",mood,1,,F,
