system_id,dataSource,artUrl,artDate,artTitle,artContent,boardID,commentCount,department,gender,school
160,Dcard,https://www.dcard.tw/f/mood/p/255937717,2024-06-24 06:31:06,低氣壓的心情,"一切以為是單純血壓高 
卻不知為何突然在還沒到回診那天跑去看醫生
登愣登愣登🥶血小板出逮擠了！
醫生告訴我 血壓高可能有其他原因
不會是單純高血壓 可能你的血小板異常高
正常人來說血小板數值在15萬-45萬
而我本人已經來到了120萬😫😫😫
家醫科立馬開轉診要我去大醫院血液腫瘤科

突然覺得一個乳房的疾病
檢測出一堆有的沒的毛病
後來隔天到了台北榮總血液腫瘤科

初診大家都明白
也是檢查做不完 光抽血就抽了8管
連抽血的護士姊姊還說 初診齁 抽很多唷
眼睛一閉都不知道是多長時間才抽完

等報告的時間確實蠻長煎熬等待⌛️
醫生把我叫進去 面露難色 不敢說話
連陪我進去的媽媽也怕聽到壞消息
索性醫生問 家族是否有遺傳類似血液疾病
我媽大力地搖頭 都沒有這些 到底怎麼了
醫生告訴我我的血小板確實高於平常人3倍
現在無法斷定是什麼原因導致 要一一排檢
目前先開口服化療藥物「愛治」治療
也一併安排超音波檢查脾臟是否有變大
就等下一次回診囉～～
續）））））",mood,0,also7786,F,可魯貝洛斯
161,Dcard,https://www.dcard.tw/f/talk/p/255937713,2024-06-24 06:30:07,隱型眼鏡 警告,"我不知道這個有沒有發對版 但我找了一圈沒有找到更適合的 有錯再告知我

📌在此警告

我18歲的時候因為隱眼戴太久+月拋沒有好好清潔+用錯保養液導致我現在已經快20了還不太能再正常戴隱形眼鏡
戴了就會超級乾然後拔隱眼要拔十分鐘加上超級無敵爆炸痛 種種心理壓力讓我現在都不太敢戴隱眼

親身慘痛經歷告訴各位
能戴日拋就儘量戴日拋 不要省這個錢 然後重點 隱眼真的不要戴太久 現在學生都習慣早上戴然後晚上回家再摘 基本上都已經超過10小時了 不要以為現在年輕不會那麼容易受損 隱眼戴6-8小時一定要摘 拜託拜託 不要像我一樣😞
不然角膜受損乾眼症會通通找上你 年紀輕輕就快失明",talk,1,aash,F,abcccdefucck
162,Dcard,https://www.dcard.tw/f/relationship/p/255937270,2024-06-24 05:34:54,分手後可以當朋友嗎,"大家覺得呢

Option #1: 可以
Option #2: 不可以",relationship,1,,M,
163,Dcard,https://www.dcard.tw/f/mood/p/255937569,2024-06-24 06:13:53,想過死嗎？,"我來自一個充滿愛的家庭。
我有愛我的父母與弟弟。
這樣的我，不應該把死亡掛在腦海。

我有憂鬱症。
這來自小學被欺負的兩年。
原以為撐過去就好了。
但事實並不是如此。

被欺負的陰影，讓我對人充滿了不信任。
更不信任的是自己。
我不認為自己是值得被愛的。

第一次憂鬱症爆發，來自大學與初戀分手。
同時間，恐慌與焦慮像鎖鏈，
牢牢的、緊緊的鎖著脖子，
刀子深深的扎著心臟，
一下又一下。

痛嗎？
我不記得了。

更痛的是發現，原來他沒喜歡過。
一切只是我一廂情願。

累嗎？
累了。

後來，我花了半年，終於停了藥。
嗯，我很棒的。

國中的時候，姐姐過世。
高中的時候，親人過世。
到後來，看了好多次的死亡。

如果這個世界上再也沒有我在意的人事物。
大概我也差不多該死去了吧。

畢竟，那時的我，
就不用擔心害怕看到身邊的人的眼淚了。

放心，我不會死的。
我還愛著這個世界。
我只是累了。

有些話，
朋友不能說，
家人不敢說。

我只能跟一個喜歡的人說了。
他說：可以不要有這種想法嗎。
多好啊。這個人。
只是這樣的我，他應該也不會喜歡吧。
不如表面正向開朗的我，
一個心上坑坑巴巴的我，
多讓人討厭啊。

從一開始就知道我和他有多少不可能。
只是這樣溫柔的人，哪怕再一下下也好。
真希望他能找到一個相愛的人，
過著幸福快樂的日子。
真希望我能找到一個相愛的人，
也過著幸福快樂的日子。

該吃藥了。
晚安。",mood,0,,F,國立臺灣師範大學
164,Dcard,https://www.dcard.tw/f/talk/p/255937515,2024-06-24 06:08:50,扁桃腺發炎快兩個月都沒好,"有夠煩
去看過醫生至少7次了
吃了無數的抗生素都沒有痊癒

不論是診所、大醫院都說沒什麼大問題（只有白白潰瘍、無化膿），就單純是免疫問題
可是我明明作息很正常、不熬夜

可是我又不想割扁桃腺，感覺很痛
討厭自己的爛身體",talk,0,,M,致理科技大學
165,Dcard,https://www.dcard.tw/f/talk/p/255937506,2024-06-24 06:07:07,正顎,"我弟弟最近做了正顎手術！
手術時間快11個小時⋯⋯
（第一台刀8.到晚上7.多）
結果回來跟我說手術的地方不會痛
是屁股超痛？？？
結果認真一看 一級壓傷欸！
整個人變獼猴屁股
https://sticker-assets.dcard.tw/images/a06f32ac-87cb-4e45-b825-31c63bf5528a/orig.png
好奇問這樣算醫療疏失嗎？",talk,0,,F,中山醫學大學
166,Dcard,https://www.dcard.tw/f/talk/p/255937542,2024-06-24 06:11:17,終身型實支實付,"最近客戶都在問實支實付，其實規劃第二張副本也不錯。
我會看他第一張額度有多少，如果第一張額度已經滿高了，在預算足夠下，我會分享終身型的，不會是定期型。
定期實支實付基本都在75歲就沒了，有的有到80歲。醫療一定是越老越需要，在高齡化社會，能保障到90歲的實支實付在未來應該幫助滿大的。
終身型雖然繳費期間只是日額，但繳費滿期後就變實支實付，沒用到還能退還保費。
雖然保費真不便宜😂
可以趁改革之前，問看看身邊業務員
有需要幫忙也可以跟我說～
https://megapx-assets.dcard.tw/videos/0d15ceba-b03c-46a9-a217-2d2d9cd3e5ee/orig?r=0.46",talk,0,nick1156,M,HANK
167,Dcard,https://www.dcard.tw/f/talk/p/255937534,2024-06-24 06:10:32,Lomography底片便宜售❗️,"全新未使用的！！

買完才發現自己買錯了🥲
原價450 賣400就好💸",talk,0,scorpio1026,F,綠豆冰沙
168,Dcard,https://www.dcard.tw/f/talk/p/255937667,2024-06-24 06:24:26,"ig看到的詐騙廣告
這些打廣告拍片的人算不算幫兇？還是根本就主謀？
不愧是詐騙王國
可悲啊低卡不知道有沒有這些人渣的朋友。","

",talk,0,slagboy,M,賽亞人
169,Dcard,https://www.dcard.tw/f/mood/p/255935303,2024-06-24 00:02:33,到職發現職務與面試所談有落差,"想問～～
公司當初主動來邀約面試，雖然覺得邀約的職務與自己經歷不符，但因為對公司有興趣所以還是去面試了。
面試過程就表明，
覺得自己經歷還不夠符合公司邀約的職務，
所以提出了另一個比較低階的工作職務，
想說可以等到有能力了在往上晉升，
主管聽了也沒有特別介紹低階的工作內容，只有提原本面試邀約的職務內容
後來有幸收報錄取通知，職務是當初談的低階職務，
但真的入職後發現低階工作 對自己來說真的太低階了，也覺得很無趣沒什麼發展性😕

想問大家意見覺得要繼續蹲
還是主動找主管談是否可調回當初要約的面試職務
或是就離職找其他更有興趣&發展的工作


懇請引路光明燈
現在每天去上班第一件事就是想嘆氣，
又要開啟全人工的一天",mood,1,,F,
170,Dcard,https://www.dcard.tw/f/mood/p/255935401,2024-06-24 00:31:55,會去圖書館的只有考生跟低端,"身心障礙考試又落榜了
已經考了12年，當全職考生的
啃老日子已經習慣了
反正有身心障礙的粉紅手冊
明年還是會再考身障特考
用猜的，總有一天會被我賽到
爸媽都公務員退休了，而且有在收房租
今天只睡3小時根本沒有睡飽
等等要去圖書館吹冷氣、手機充電
看到PTT 有一則文章說
會去圖書館的只有考生跟低端人口
我確實2者都是啦，無法反駁
但是有錢人也有很省的吧
也是會去圖書館吹冷氣、看報紙啊",mood,3,,M,輔仁大學
171,Dcard,https://www.dcard.tw/f/mood/p/255935518,2024-06-24 01:06:18,一天用電腦和手機的時間多長,"仔細想，發現自己一天用電腦和手機時間超多
從在家裡，電腦就沒關過，手機也一直用，出門也一直用手機，上班也一直用電腦和手機，幾乎整天都在用，認真算應該好幾個小時以上了，好驚人

使用時間計算，就以眼睛有盯著螢幕就算，累積起來的時間

Option #1: 一天3小時以內
Option #2: 一天3小時以上，6小時以內
Option #3: 一天6小時以上，10小時以內
Option #4: 一天超過10小時",mood,0,,M,
172,Dcard,https://www.dcard.tw/f/talk/p/255935366,2024-06-24 00:19:43,被同事說是小美女,"我都回答

是大美女

同事：好！大美女

有時候身體不舒服回答：謝謝
同事：您今天不舒服嗎？

我：對


（（大家被誇講都怎麼回答呀


https://sticker-assets.dcard.tw/images/764ff643-b618-4691-8e8b-7646a4d86e2d/orig.png",talk,5,angela999,F,草莓優優
173,Dcard,https://www.dcard.tw/f/relationship/p/255935432,2024-06-24 00:39:34,Bumble 盜用照片（？,"Bumble上真的可以盜用別人照片去成立新帳號嗎？並且獲得認證是真人？如下圖這個紅框處的顯示

因為我男友被我朋友發現有創立一個新帳號，但他說這個不是他創的，我檢查了手機，的確沒有看到任何東西，但我不確定是不是真的被盜圖辦帳號….？

我男友跟我說叫我朋友檢舉這個帳號，然後會拿到一些檢舉資料，但我朋友說檢舉才不會拿到這些東西@@

我不知道我要不要相信他是無辜的？？？？",relationship,1,,F,
174,Dcard,https://www.dcard.tw/f/mood/p/255935344,2024-06-24 00:15:59,重新就業,"去年因為身體有異加上家中需要離開了一份夠開支也能存點小錢的工作，休息幾個月後抱持著維持基本生計就找了鄰近傳廠就業，但因為該廠有太多不符合勞基法的黑暗面（不依照加班費給薪、加班費需要績效獎金二擇一領取、週末加班不行打卡領平均日薪），人事在我提出疑問詢問時已不適任開除。（同事都是二度就業或退休的媽媽、阿姨們，所以都是抱持有薪水入袋就好）

今年因為準備結婚關係，索性提早搬出原先家中在先生家附近找工作。台南鄉下基本上是逃不了27470，但真的離夫家是近到不行的五分鐘車距，所以就開始上班了。但不知道是不是休息太久，在重新面對職場時變得容易受創也容易焦慮，有一點庸人自擾的鬼打牆。

本身有焦慮跟憂鬱（有吃身心科藥品），所以一發作就是拉肚子、吐、想逃避。但不工作也不行，先生的薪資用在房貸車貸，自己的支出還是要靠自己。

我以為只有高收入才需要煩惱，沒想到基本薪資也是一個煩惱。",mood,0,,F,
175,Dcard,https://www.dcard.tw/f/mood/p/255935461,2024-06-24 00:46:31,身體臆形症+非特定焦慮症？,"吃了兩年的精神藥物
診斷是身體臆形症+非特定焦慮症
非特定 跟 特定差別是什麼呢？

1.是算容貌焦慮嗎？
2.請問有什麼比較能放鬆的方法…
2.是不是不要做服務業比較好？可是工作想做美髮…

希望有了解的能跟我說一下，謝謝⋯",mood,1,,F,
176,Dcard,https://www.dcard.tw/f/mood/p/255935403,2024-06-24 00:32:42,反省,"人在當下
總是想做
自己想做的事
都沒想到後果

只有當發生事時
才會反省自己

所以

做事前

要三思而後行",mood,1,kiss661215,F,嫣兒
177,Dcard,https://www.dcard.tw/f/talk/p/255935451,2024-06-24 00:43:05,一隻9個月大的貓有辦法在明年10月初吃完10公斤的飼料嗎？,問號問號,talk,0,kun___cool,M,北屯小K
178,Dcard,https://www.dcard.tw/f/mood/p/255935460,2024-06-24 00:46:29,手上完全沒有不動產是誰的問題?,"發這個政治不正確肯定是會被罵啦，
但實在不吐不快。

台灣手上累積有不少土地的人大部分人都是三、四代前的祖先就開始少量購買，一代傳一代積少成多。
從大陸渡台歷經清領和日治，有錢人根本是少數，目光短淺的人賺多少花多少，目光長遠的人就算沒什麼錢，但有點錢就拿去買土地，才能夠留給後代子孫那麽多的資源。

到底為什麼人家幾代人的積累你會覺得想用一代人的努力追回?

譴責那麽多，還不如下次拜拜的時候講給公媽聽",mood,0,,F,
179,Dcard,https://www.dcard.tw/f/mood/p/255935444,2024-06-24 00:41:58,香味攻擊,"今天早上搭車上班
後來有一位中年女性上車後坐我前面
她才剛靠近整個香味撲鼻而來
味道超級濃郁

我本來想說十分鐘後應該就麻痺、味道會散一些
沒有！！！
反而讓我反胃的感覺越來越嚴重，而且冷氣風很強我卻一直冒冷汗
到後面是真的受不了想說先下車吐好了

後來發現那個人的前排剛好還有空位就換過去
因為下車還得再等15分鐘才會有車，上班可能會遲到
還好換位置後就沒有再被香味攻擊了…

有人懂我的痛苦嗎
https://sticker-assets.dcard.tw/images/a0186c29-eae4-4799-ab4d-d60f5b7c957f/orig.png",mood,1,,F,
180,Dcard,https://www.dcard.tw/f/talk/p/255935319,2024-06-24 00:07:49,我嚴重懷疑 我的包裹掉在國道上TAT,"




嗨嗨 我是曉雪
不知道大家在 618 有沒有人也趁購物節
蝦皮免運網購一波
我那天下單了三件商品
有一件是賣家當天就出貨的
結果另外兩件都是隔幾天出貨
但是都已經到貨了
只有最早出貨的夏季制服組沒到
逛網路新聞 直接爬到
由於已經是第七天了
深深懷疑我的包裹根本掉在國道上（燦笑
那個新聞圖的橘色箱子 怎麼看怎麼像
蝦皮店到店前面放的貨運箱
我就住中壢
實在太可疑了🤣
因為今天客服9：00才上班
等等來去問一下
如果一直沒到貨 我應該要處理嗎？
還是這是賣家比較需要注意的
其實我不知道😅",talk,0,h06020405,M,曉雪
181,Dcard,https://www.dcard.tw/f/talk/p/255935330,2024-06-24 00:11:39,不知道中國大陸人民現在有沒有日本生魚片可吃？👀,"昨天中午實在太熱了，決定吃生魚片當午餐，超豐盛的，想到祖國大陸同胞不知道有沒有日料生魚片可吃？

https://sticker-assets.dcard.tw/images/7051b987-3b0e-4a1d-bc30-f16b9af8e8ce/full.png",talk,1,crazyrabby,F,䕒🐰
182,Dcard,https://www.dcard.tw/f/talk/p/255935337,2024-06-24 00:13:40,娛樂城AT99,"想請問有人玩過AT99嗎？
是可以正常出金的嗎？
上網爬文說娛樂城都是要拍身分證正面和和存摺
但又怕被拿去騙ಥ_ಥ
",talk,0,,M,邦德大學
183,Dcard,https://www.dcard.tw/f/talk/p/255935669,2024-06-24 01:38:36,尋找子彈吊飾原子筆,"如題，正在尋找有子彈吊飾的粉紅色或粉紫色的原子筆🥹這是20多年前的筆了，不管我怎麼找都找不到😭

那是我兩歲時我爸送我的聖誕禮物，那時候家裡經濟狀況很差，但因為我對聖誕老公公深信不疑，爸爸不希望我的希望破滅，所以爸爸偷偷把這個原子筆放在我的枕頭邊，那時候很寶貝這支筆，結果搬家的時候不小心弄丟了，加上最近爸爸去世了，突然想到這個爸爸送的第一份禮物🎁一直希望可以再碰見那支筆😭

如果有人家裡還有的話可以賣給我嗎🥹😭",talk,0,kkhhi,F,羊角麵包
184,Dcard,https://www.dcard.tw/f/talk/p/255935598,2024-06-24 01:23:08,#協尋學生證,"想問一下有沒有人6/22（六）在忠孝新生站或是華山撿到中原大學會計系學生證🥲
搭捷運去華山玩以後回來就發現不見了
遺失時間大約是下午！希望能夠找回來
https://sticker-assets.dcard.tw/images/05c2c9f2-5310-43e1-979c-08f57ad0d7dc/orig.png",talk,0,,F,中原大學
185,Dcard,https://www.dcard.tw/f/mood/p/255935542,2024-06-24 01:10:44,女友line搜尋紀錄 出現*不明*,"如題 請問各位大大 ， line搜尋紀錄出現不明，點下去後寫說此聊天室已不存在之類的

問女友，他說他不知道，他沒有刪對話紀錄跟退群組，請問有人有類似經驗嗎

自己試過刪除對話紀錄跟封鎖 就會顯示不明

心情好複雜",mood,0,,M,
186,Dcard,https://www.dcard.tw/f/mood/p/255935848,2024-06-24 02:16:39,各種吃醋,"🫠
🫠
🫠

交朋友吃醋，
有男友吃醋，
一有不對的地方就說是不是妳身邊的人洗腦...


發生地點：原生家庭

已經受夠這樣不斷重複的模式了。",mood,0,,F,
187,Dcard,https://www.dcard.tw/f/talk/p/255935736,2024-06-24 01:51:23,怎麼陪男生過生日？,"我想問一下，
男生們會希望怎麼陪伴度過生日的呢？",talk,0,asd0102,F,小妮妮
188,Dcard,https://www.dcard.tw/f/talk/p/255935556,2024-06-24 01:13:34,你們會在意另一半沒讀大學嗎？,如題，你們會在意嗎⋯？,talk,1,hhhhhhhhhh____,F,睡飽了
189,Dcard,https://www.dcard.tw/f/mood/p/255936254,2024-06-24 03:18:25,從小到大被媽媽情勒孝親費,"這是一個不止孝親費的故事
而是30年來的愛恨情仇

我是媽媽第二段婚姻的小孩
前面還有一個同母異父的姊姊
爸爸生我的年紀已經5X
記得年幼時都是爸爸帶我長大、很疼愛我
但爸爸在我15歲的時候因病離世了

後來在我有印象以來，上國中、高中、大學、補習、生活費等等的
只要是媽媽幫我繳錢的時候都會一直唸
說我長大要還她錢
說我的幼稚園、補習費、才藝費很貴等等的
後來大學唸的是私校
媽媽每學期唸的更嚴重
每次繳學費都要看她臉色
她都會說以後要還她錢

當時的我跟她說我可以辦學貸
她說還她錢不用利息，就不了了之了
現在真後悔沒有狠下心說自己辦學貸就好

後來研究所硬是考上國立大學
自己想辦法半工半讀繳學費
為了就是不想看到媽媽的嘴臉

記得我還大約國高中的時候
媽媽曾經跟我說過，當時要不是肚子裡已經有我了
不然也不想嫁給我爸爸
她可能以為我還小不會記得，但我記得清清楚楚
當時爸爸生病住院躺在加護病房
我回家發現媽媽跟小王在家翻雲覆雨
這個畫面我一輩子也不會忘記
那些瑣碎的片段，每一段記憶都是一道傷痕

我很想跟她說
又不是我叫妳把我生下來的
也不是我自己要求要唸很貴的幼稚園
小時候根本也不懂，也不是我吵著要補習的
是媽媽自己選擇把我生下來
為什麼生下來之後的花費
要我長大以後還她？

現在出社會了
每個月要給一筆孝親費
具體數字並不重要，我賺的夠多付得起
但心裡很不好受
時不時要聽她唸我
說養我長大花很多錢、給她錢是應該的
小孩本來就要孝順父母（標準情勒法）

我知道爸爸離世時有留一筆遺產
不多不少但我很確定養一個小孩到成年的基本開銷一定夠用
媽媽也不是真的缺錢
她常常出國旅遊、買名牌
但她總說小孩用錢孝敬父母是應該的

我在這邊要說，父母養育孩子
小孩感恩父母合情合理
用任何形式來孝順父母我覺得都可以
如果父母經濟狀況良好、身體健康
孝順父母也並不一定非得要是錢

像我這樣的媽媽，我從小被她言語暴力
長大被迫規定一定要給她錢
敢不給就被說不孝子、不知感恩
心裡真的很不舒服

媽媽確實給了我好的資源栽培我長大
如果沒有那些嘴臉跟言語暴力
我也會心甘情願給媽媽錢的

要怎麼讓媽媽知道
讓孩子心甘情願主動孝順父母
比父母逼迫孩子討錢要來的好呢",mood,0,,F,
190,Dcard,https://www.dcard.tw/f/relationship/p/255935953,2024-06-24 02:31:21,包養暈船,"最近在包養網認識一個小我四歲的女生
因為我們個性有很多相似的地方
明明才見兩次面就已經有種認識很久的感覺
現在有股衝動想把她娶回家
但不知道她是不是真的和我有同感還是只是逢場作戲🥹",relationship,4,,M,
191,Dcard,https://www.dcard.tw/f/talk/p/255936136,2024-06-24 02:57:06,和男友過夜要穿什麼,"最近要第一次和男友出去過夜，但不知道睡覺要穿什麼比較合適～
平常在家都穿UQ的細肩帶背心，不知道第一次過夜穿這樣會不會太裸露😅


還是大家覺得穿男友的衣服睡覺就好🤣這樣我就不用多帶睡衣了哈哈哈

謝謝大家
https://sticker-assets.dcard.tw/images/1fce248b-db7e-4d96-aa93-7370f2eb9c1e/orig.png",talk,2,,F,實踐大學
192,Dcard,https://www.dcard.tw/f/relationship/p/255936092,2024-06-24 02:50:27,女同事帶我破處之後對我射後不理⋯⋯,"如題 
兩年前我還是個母胎單，身邊沒甚麼女生朋友，只能靠交友軟體認識異性跟聊天，但可能比較不會講話是個鋼鐵直，所以最後都是不了了之

（大概就是這點程度..）

女生同事説了一句話很傷人但也點醒了我：
「這個照片一看就不會想要往右滑啊！」

我會右滑漂亮妹子，漂亮妹子憑什麼要右滑我這種不會打扮的臭宅？
當下痛定思痛，請女生同事開始幫我改造外貌

一開始真的是滿痛苦的，光採購新衣服，找厲害的設計師弄髮型，荷包整個大失血
（女同事表示：跟女生化妝品保養品比起來，這個真的是小錢）

一開始有請女同事跟店員幫忙搭的衣服風格，穿起來有點彆扭，設計師弄的髮型，也不是很習慣（畢竟以前都是習慣簡單乾淨就好，沒有試過偏韓系的衣服跟髮型），服飾店的妹子店員表示：「可是真的很好看啊」，好喔，難怪男裝店這麼多漂亮妹子，我瞬間破🏠，嘗試新的打扮，磨合了一年多慢慢找到自己能接受的風格。

除了髮型跟穿搭，這年代男人沒有點肌肉也是不行（女生同事說：他超愛在床上抓她男友的胸肌👀）我也報了萵苣會員，巨巨朋友幫忙帶練調訓練跟飲食菜單，肉量也有慢慢上來，但自己自律也很重要

一年多的改變，我很感謝當初給我當頭棒喝的女同事。交友軟體Match的機率變高，跟身邊的女生也開始比較有話聊。想說有一點小成績也是因為他，就請他吃飯表示感謝

喝了一點小酒，話題尺度變得有點開，他告訴我，我的改造還沒有完成，還有最後一關，她說「長得好看但床上不行的男人，沒有女生願意守活寡天天假高潮」
痾⋯⋯母單狗我本人也不知道我在床上的表現會怎樣，真要上戰場，好像也沒什麼把握

：「可是我沒有經驗，我也不知道我在這方面O不OK」
他好像真的喝多了，掐著我的臉跟我說
：「想要姊姊教你嗎？」

不要說單身狗，任何一個正常的男人遇到這種事情，有幾個能夠把持得住？！心理雖然很糾結，身體卻很誠實，當天就被「拐進」同事家裡，我的第一次，就這樣被奪走了..
原本以為就只是一夜風流，但穿上褲子之後開始要面對現實了，不是各位想的那樣，他沒有逼我跟他交往，但他開始一一指出，我剛剛有哪些地方做不好，媽啊，我超想找個地洞鑽進去。

「小子，不要以為變帥一點了就開始得意，你的路還很長遠呢」

乾⋯身為男人被這樣講，真的超爆丟臉，丟臉的點在於他講得每句都是事實，我無法反駁

：「那我要怎麼做才會更好？」
：「這是你自己的作業，去找找有什麼資源，我不是什麼義工，沒有時間跟菜鳥天天陪練」

蛤蛤蛤？這算是一種「射後不理」嗎？說我有很多地方需要改進，但是又沒有告訴我改進的方法...
這一年多有很多改變，我也很願意努力嘗試，衣服打扮有服飾店店員，髮型有設計師，體態有巨巨教練，但床上這一塊⋯我要去哪裡學？",relationship,2,,M,黎明技術學院
193,Dcard,https://www.dcard.tw/f/mood/p/255935912,2024-06-24 02:25:45,現在的人這麼特別？,"最近用交友軟體聊了幾個人，加了賴，秉持著人脈多多益善的原則，順便練習聊天，然後很神奇的現象出現了。
加完賴後大部分都聊生活，聽對方抱怨，有一個很特別的人類，聊了幾天後突然意識到沒有交換過照片，然後問我要不要交換，我說我的賴頭像就是啦，然後她說要再一個，我原本也不當一回事，就是對方傳了一張後，當下我就隨手跳了一張戴墨鏡和樹王（大樹一棵）的自拍，回家後突然好奇，把對方的圖片下載下來一看，檔名。
30+的女人如何维持气质_某某某__小红书网页
當下的想法，阿勒阿勒，這年頭盜網圖連檔名都懶得改的嗎？
隨口問了句，對方回答說自己是桃園人，沒有在用小紅書。
哎呀呀，我覺得吧，這人打算幹嘛呢？
不得不說，隔天這位還再傳早安呢，我想想，還是列入網路詐騙的觀察名單吧，不知道這樣我的聊天技巧練習會不會有成果？
https://sticker-assets.dcard.tw/images/1c15b95f-9852-4bc6-b3af-12fd1576af25/full.png",mood,1,,M,
