system_id,dataSource,artUrl,artDate,artTitle,artContent,boardID,commentCount,department,gender,school
68,Dcard,https://www.dcard.tw/f/relationship/p/255938280,2024-06-24 07:35:42,在意男友的異性朋友,"一直知道男友有幾個異性朋友
三不五時就會聊一下天

某天我好奇看了男友手機
（我們互相知道密碼 也有FACE ID）
猛然看到一個異性朋友（簡稱A女）

💬對話1
（A女在抱怨她遇到渣男）
男友：搞不好最後你會覺得是個男的都好
A女：那我找你不就好了？身體合心靈又相同
男友：被人捷足先登了（誤
A女：那就等你分手啊ㄎ
A女：我是真的很珍惜這份感情，不論是友情還是其他，看著我長大，包容我的霸道
男友：我也很愛你啊

💬對話2
（聊天到一半突然傳語音）
A女：你有沒有想我啦？
男友：你覺得呢？
A女：應該想爆了吧

諸如此類的對話我很不能接受
覺得非常沒有界線也很不尊重我
所以我跟男友溝通了
男友的意思是說
他們本來就是會這樣打嘴炮
但我實在沒辦法接受這麼沒分寸的對話
於是男友有和A女說以後聊天不能這麼沒分寸了
而A女也表示抱歉並請我放心

但之後….
卻發現他們用IG即焚模式來聊天❗️

我會知道他們用即焚模式是因為有天我跟男友說
你跟學妹之後有聊到我嗎？
我可以看看你們聊了什麼嗎？
於是男友開了IG發現怎麼沒有對話紀錄
（男友當下表現的很疑惑，好像真的不知道什麼是即焚模式）

沒想到溝通後
換來的只是更隱密的聊天方式
真的很難讓人不懷疑….

我到底該不改繼續溝通下去
還是直接放生？",relationship,2,,F,
69,Dcard,https://www.dcard.tw/f/relationship/p/255938771,2024-06-24 08:35:29,我真的適合談戀愛嗎,"跟大家分享個故事
我在網路上認識了一個女生
我一開始認識她的時候
他是有男友的
所以我們聊天的內容也是就真的像朋友
我在這方面我覺得都做得不錯
確實沒有甚麼越軌的話
慢慢聊了大概三個月
坦白說在這三個月我對他的好感
有一直在往上升
但我並沒有表露或是表達出來
回訊息的時間也很正常
都是幾個小時回一次
反倒有時候她回我的頻率比較快
在我認識她的第三個月她跟交往三年的男友分手了
很自私的心態其實我是開心的
也在她分手沒多久後
我開始直球對決
把我心裡想說的跟她說出來了
她也承認最近一陣子對我有好感
（先跟大家說她分手的原因是，她們是遠距離但她的男友太忙了，忙到一天可能才一則訊息，他們交往了三年，後面的兩年大概都一直是這樣的頻率，她實在受不了了才決定分手的）我知道這些事後，她是希望我不會像前男友一樣忙到這麼誇張，雖然她自己也很忙，但一天一則就像單身的感覺她不要，所以我們有點進入曖昧期，我發訊息給她的頻率也越來越高了，有一次我順勢跟她說了我等等要幹嘛，她很開心認為我會報備給她，我覺得這只是小事，但竟然她開心那我就常這麼做也沒關係，聊了很熱絡的一個禮拜，突然有一天感覺不同了她在前天跟我說她明天會睡比較晚，我說好沒關係（因為隔天她放假），結果他到下午五點才回我，我其實有點訝異，因為我前面傳了很多的訊息，但變成她好像那一兩天有點不怎麼回我的感覺，然後到了前天，（這是維持這樣的第三天）她也是忙的很誇張大概整天只回了兩則訊息吧我就在她下班的時候打給她，結果她在通話中一個小時，其實當下我的情緒控制的沒有很好，我說的沒有很好並不是發怒，就是訊息有點歇斯底里，不過她也沒解釋甚麼，她說我嚇到她了，幹嘛突然大驚小怪的，我覺得在這次的處理方式我確實太超過了，我也很快的跟她道歉，不過他看起來也沒甚麼想原諒我的感覺，我們本來是都快要在一起了，發生這件事後他說她不一定會跟我在一起了，我覺得這是我活該所以我並沒有回說甚麼，就只有對我那天的語氣行為感到非常抱歉而已，直到今天下午也就是剛剛我被封鎖了，我覺得我沒有一直騷擾她了，我在早上回了一條也只有老實跟她說，如果她認為我那樣的行為她真的無法接受可以老實跟我說，我會主動離開，但我沒想到過了一天（中間還是有傳一些訊息）我就被封鎖了，其實我會這麼黏她是因為她說不希望有前男友那樣不理他的感覺，在熱絡的那一個星期，我們訊息我老實跟她說我在玩遊戲他都還會吃醋叫我陪他，為什麼突然過了一個星期就變這樣了，我不懂我只是照她想要的方式去陪她阿，不然我也可以慢慢回就好了。


跟各位大大分享這些並不是要說她都是錯的，我都是對的，我相信在這裡面大家也都看到我有蠻多可能讓人不舒服的行為，我是想問說如果再遇到這種的情況我應該怎麼拿捏，還是維持原本聊天的節奏就好，我真的不太知道我該怎麼面對下一個我會遇到的人，有女生可以為我解答一下嗎
我是哪裡做錯了 還是哪裡誤會了嗎
因為她也說過想當我女友


（P.S 我是有交過的人不是母單）
我的外表我覺得就是很普通
我認為不會說到好看 但也不會說到很醜
可能就身高稍微會有人喜歡吧（185）

麻煩大家幫我解答一下
我知道自己不是個很好的人
大家的意見我都會虛心接受",relationship,0,,M,
70,Dcard,https://www.dcard.tw/f/talk/p/255938285,2024-06-24 07:36:18,思考是否要考學士後醫學,"現在是藥學系學生，認真想請大家給我一些意見，下面有我考量的點，希望大家能夠給我一些人生建議🥹 希望大家都事事順利～

想考與不想考的點
1. 薪水並非想考的原因，雖然醫學藥學薪水的確有差，但因為本身原生家庭無經濟壓力，加上我喜歡女生未來沒有養育小孩的花費問題，藥師在南部8-9萬上下的薪水養活我自己覺得綽綽有餘。

2. 興趣問題：我自己有點奇怪，因為自己本身沒有什麼非常熱衷熱愛的興趣（例如追星、潛水、露營….等等），對於什麼事都比較偏向可以做，可以喜歡，但不會投入，沒有很需要撥很大一段時間去做這些事，因此藥師可以選擇彈性上班時間或休假（限非醫中）這一點我好像也沒什麼差。

3. 生涯考量：如果進醫中，基本上天花板跟地板差不多（職稱的部分），醫師會有很多階段的晉升，蠻符合自己對成就感的慾望。

4. 真正喜歡的事： 仔細想想真的喜歡的事就是待在家人身邊，但從二十幾歲開始就沒有目標或挑戰的過日子又會讓我有一種，不知道自己有什麼必要存在？覺得假設自己最愛的家人走後好像就無牽無掛了？這一生就這樣了？好無聊的感覺

5. 因為自己沒有什麼很熱愛的興趣，甚至會冒出還是我來學寫程式碼修課跨足二類呢？但這些想法背後都是不知道自己為什麼想這麼做

講的有點怪，但是希望大家能給我一點方向，或是分享人生經歷，目前我有點迷惘
https://sticker-assets.dcard.tw/images/3f8135cb-c935-4885-ac6d-dd6756cf7f82/orig.png",talk,0,,F,高雄醫學大學
71,Dcard,https://www.dcard.tw/f/relationship/p/255938146,2024-06-24 07:21:30,跟自己老師發展成情侶關係的例子多嗎？,"知道目前社會上對這樣的互動多有批評
但如果有機會也有默契不影響彼此生活
跟指導老師在你情我願的狀況下發展成這樣的關係
請問這種狀況會多嗎？",relationship,1,,F,
72,Dcard,https://www.dcard.tw/f/talk/p/255937981,2024-06-24 07:02:45,這下全包了…,https://megapx-assets.dcard.tw/videos/9634f223-5c95-4d61-b33f-3090788bf589/orig,talk,1,taiwanmobilenet,M,台灣強尼
73,Dcard,https://www.dcard.tw/f/mood/p/255938696,2024-06-24 08:26:42,備考壓力大到一直失眠怎麼辦？,"最近在備考研究所
雖然很慶幸自己大學期間玩得很克制
沒有整個放飛自我，不然我大概也碰不到研究所了
但從決定要考研的時候就很緊張
每天刷題庫、準備甄試還有寫考古題
壓力真的很大，慢慢逐漸變成整個精神狀態很疲勞
躺在床上需要花好幾個小時才能入睡
已經快忘記好好睡一覺是什麼感覺了😢
每天失眠到早上，專注力跟反應能力都變得很差
整個人超像喪屍.......
該讀進去的書，隔天再複習的時候就發現自己忘了
什麼冥想或瑜伽打坐放鬆身心我都試過了......
有人跟我一樣的嗎任何方法都可以😢
這種失眠的問題到底要怎解？",mood,0,,F,朝陽科技大學
74,Dcard,https://www.dcard.tw/f/mood/p/255938262,2024-06-24 07:34:05,好像不適合做餐飲,"雖然不是第一次做內場，之前也有做過食品工廠助手，但最近應徵咖啡店，上工第一天結束，突然發現我好像真的不太適合這領域，難怪都做不久。

體能較差，長時間站立走動很痛苦，本來想著過段時間會好，但1個月後還是覺得身體很疲勞；我的神經也挺衰弱敏感，一直趕出餐壓力很大，似乎不是做久熟悉流程後就會好轉，訂單就像定時炸彈倒計時，讓我很緊張。

午休也很不固定，如果又碰上狹小的備餐區，只能窩在角落休息，還只有30分鐘，吃的也是非正餐，簡單吐司或幾個炸物而已，身心疲憊胃口差；工廠好些，有完整1小時，但沒供餐還經常加班。

餐飲只有供餐跟薪資較高(底薪卻低)吸引我而已，其他部分都是缺點，輪班輪休也累，感覺較適合打工，正職工時長、責任重，難怪有人轉兼職。

我媽倒是對咖啡店很感興趣，要我努力學習，有空去youtube看看怎麼拉花...她應該自己去做才對，我對這行業挺無感，也不愛喝咖啡，只是求職沒方向才試試。

受訓期要去別的分店，每天5點多起床，6點多趕公車，7點上班，目前雖然是做兼職，但我覺得一天5小時已經夠了，未來變正職我會爆炸吧！好想換工作，但父母會嫌我怎麼這麼簡單的都待不住，煩。",mood,0,,F,
75,Dcard,https://www.dcard.tw/f/relationship/p/255937888,2024-06-24 06:53:18,被另一半要求過最奇怪的事,"男友是年紀比我大的理工男 在一起兩年半
他不像大家口中的理工木頭 反而很像小女生
身邊朋友都說我們很像角色對調 我才是男朋友🤣
他還常常要求我做一些奇怪的事情（不是色色的事情！）

奇怪事件1
平日我都住在家裡 假日會去男友家住
因為公司離很近 下班會去約會
約會到家他也會繼續黏我要一直視訊
就算他很累也還是要掛睡
連我去廁所他都要我帶著手機去
更誇張的是就算已經住在男友家
連拉屎他不是硬要進來跟我聊天
就是也要我在裡面跟他視訊😫😫😫
有時候很無聊還會關我燈


聽我在裡面尖叫大罵他也開心
常常手機都因為這樣忘了充電
有好好跟他溝通過才達成共識
沒有約會的時候再視訊就好了

奇怪事件2
走到哪都要牽手 夏天很熱也不能放開
如果不牽也一定要勾著
沒做到他會鬧小脾氣
牽手就算了 這我可以接受
在家還很喜歡牽我的腳指頭 而且是十指緊扣的那種
腳指頭被撐開很不舒服！講好幾次都不聽！

奇怪事件3
上班的時候我都是用咖啡跟手搖杯續命
最高紀錄桌上有三個不同的飲料
男友看不下去 每天都要我喝水
跟他抱怨水不好喝 公司飲水機又離我很遠懶得走路
而且還很常忘記帶水壺去公司
他大哥直接訂了兩箱寄到我公司


還要強制我每天回報喝水進度
最奇怪的事 我每喝一瓶就要拍照證明我喝完了…


到後面我只能從報備裡苦中作樂


最後喝完還錄影片給他看


下班後跟他分享今天的採罐戰績 還在亂吃醋😡


有時候真的會覺得 為什麼年紀比我大還可以這麼小女生
很愛做一些奇怪的要求又愛吃醋
但我知道他是因為很愛我跟擔心我才會這樣啦
雖然偶爾會覺得他真的超煩 可是看到他的臉又覺得很可愛😍
還是會繼續包容他的奇奇怪怪🩷",relationship,11,,F,世新大學
76,Dcard,https://www.dcard.tw/f/talk/p/255937813,2024-06-24 06:42:21,減肥路上遇到詐騙,"現在很多人遇到減肥詐騙 我也不例外。。

之前在哀居上看到減肥的廣告 由於我很愛吃又想變瘦 所以就加賴去了解 一開始都是在了解我的身體狀況 後來就是在說關於瘦身要喝的東西 其實這些我都覺得很正常 然後他就說要給我3個方案讓我去選 啊當然我一定是選最便宜的方案 原價是9560然後限時優惠4800 其實我看到這個價格 我就不太想買了 但他說可以申請學生方案 只要3500就好 我就想說好吧3500付完就可以減肥好像還可以 所以我也就同意了 領貨之後我也沒有特別看什麼 就是喝 
後來過幾天 他才跟我說有第二階段第三階段 
他說考慮到我的經濟方面應該會比較緊張 所以他去跟上司說我是他的朋友 所以可以申請最低優惠價 第二階段原價要38000 他用他的私人帳號幫我墊付 所以收我材料費8000就好 第三階段原本要25000 但他要直接送給我
當然我拒絕他了 身為一個沒有工作的學生 怎麼可能付得出那麼多錢 但是他一直說不能耽誤 然後說我會想找他一定是真的想瘦身 然後就開始一直說服我他就說叫我付5200就好 剩下的他會用他私人帳號墊付 啊我還是一直拒絕他 他後來說 我就差最後一步了 我想辦法出4500就好剩下的他會想辦法 我也是一直拒絕他 後來他說3500 然後我也不知道我到底在蠢什麼我就答應他了
後來他就說我的脂肪都堆積在一起 所以效果不是那麼好 然後說要幫我解決 然後就說要42800 但因為這關係到他的考核 所以他會出30000 叫我出剩下的12800 然後他說他要升職他會拿到150000的獎勵 所以我付出的那些錢他最後都會歸還給我 所以我付那些錢都只是形式上的而已 但是當然 我沒有那麼多錢所以也是一直拒絕他 然後他說我自己想辦法付5000剩下的他自己想辦法 我也是一直拒絕 後來就說3000 我也不知道我哪根筋不對 可能是想說最後都會還回來 所以就答應了（會答應的原因之一也是因為我確實有瘦下來）
後來他說剩下最後的全面吸收 要90000 然後他說他用自己的私人帳號出80000 叫我自己出10000 但我真的沒錢沒辦法出了 我就說我真的沒辦法 最後說出2500 所以我也就硬擠出2500
但其實說真的 我真的不知道我那時候到底在幹嘛 超級愚蠢欸 他一直重複說他不吃 幫我墊錢 我都沒發現 從什麼脂肪堆積的時候就說他不吃了 結果最後一次的那個90000他還可以出80000 超扯的啊 我竟然沒發現 有夠白癡
後來我想說 結束了 結果後來他說 我還有7500是欠的 沒有結清 其實這裡我就蠻傻眼的 因為我那時候是說我付2500 但我又想說 可能是我跟他沒有說清楚 中間我也是有跟他辯 然後他一直說要去上訴 什麼的 但我那時候有什麼都沒發現 真的有夠白癡 然後我還一直跟他道歉 他那時候應該覺得很爽 沒有想到我竟然那麼好騙 其實我膽子很小 我也沒被騙過 我還一直覺得他人很好 願意幫我墊錢 根本沒有想到說 買賣根本不會有墊錢的事情發生 後來我就去借錢來付這些錢
錢都結清之後 他說他要把手機給院長 讓他跟我談 然後那位院長就說之前有一位學生跟我一樣狀況 到後面都不回訊息 然後最後收到法院傳喚然後付了15萬的罰款 他還傳截圖給我看
後來過一段時間他說我結案不了 我有14處空白檔案 老師是可以幫忙的 但不能全部負責 然後就開始說一處是12000 但因為執行效果理想所以一處只要5000 老師會出85000 我要出35000 而這些錢最後也都會還給我 
然後我就很傻眼 直到這時候我才發現很奇怪 然後我就說 我已經把我的欠款都還完了 我為什麼還要付錢
然後他說 因為我之前有欠款問題 還有老師幫忙墊錢的事情是違規的 （好 其實我聽到這裡很不爽 我超想直接說 他要墊錢關我屁事 你找他沒事找我幹嘛 而且照理來說我已經把該還的都還完了）然後他就說 不然你要像上面那麼那個人一樣被法院傳喚然後付15萬？
然後他就開始很不耐煩的回答我 但我那時候真的超害怕 我超怕要付15萬 然後被抓去法院 他也說要上訴什麼的 然後我就跟一個沒見過世面的人一樣超好騙 後來我也答應他 用分期的方式
其實在這裡我害怕歸害怕 但我還是很懷疑他是不是騙人的 然後問他說他們公司叫什麼 他就說他是研究所沒有公司 然後他一直很暴躁 偏偏我就很弱 也不敢說什麼 因為不想惹麻煩 後來過幾天我就問負責我的老師 他們是什麼研究所 他說「生產開發科學研究所」然後傳了一個連結給我
https://seiken-site.or.jp/
然後他就跟我說 ：妹妹你也把你住址給我 我也要做一下登記確保妹妹會按時還款妹妹守信用不會逃單喔
啊當然我再怎麼愚蠢也不會蠢到把家裡地址給他 然後到這裡我就覺得很好笑 到底是會有誰把地址給他 然後讓自己陷入危險 喔其實他之前說什麼會有警察來我家什麼的 我就有覺得很奇怪 他又不知道我家在哪裡 怎麼可能找得到我
好然後我爸媽看到我丟的那些回收（那位老師寄給我的）然後我爸就說 你在喝這個喔 這大陸的東西你敢喝喔 而且這沒有經過食品安全檢查欸 到時候你把身體喝壞掉 到時候要洗腎怎麼辦
然後其實到這裡我才開始擔心 因為說真的 我開始喝之後 食慾變很差 東西吃越來越少 明明好幾個小時沒吃東西了 東西擺在眼前吃幾口就不想吃
然後後來我開始在網路上找可以諮詢的律師 他說這都是詐騙集團的手法 他們處理過很多這樣的案件 他會用什麼法院來嚇你們讓你們害怕付錢 然後我超害怕超緊張 那個律師還很有耐心的一直安撫我 然後跟我說 不要害怕 他不會來找你 你現在去跟他說 到地檢署找檢察官說明 後來我說完之後就把他封鎖了 但我現在有點後悔 我不應該封鎖的 我應該要好好陪他玩 但就算現在解鎖也不知道他在我封鎖他的期間有沒有傳訊息給我

我其實發生這件事情之後 應該是說發生3萬5之後我才覺得很奇怪 我才跟我爸媽說這件事情 哈哈我可能被他們保護的太好 導致18歲了還不知道這是詐騙 我還天真地以為他人很好願意幫我墊 現在發現我真的蠢到一個極致 有夠白癡的 我爸媽也是很傻眼 重點是我害怕到把他封鎖之後還刪掉 現在整個對話都消失了 根本沒辦法告他 有沒有什麼方法是可以告他的 詐欺跟恐嚇應該都有 但是沒有對話 這樣要怎麼告 求解🆘

總之 經過這件事情我也能說 花了2萬多買個教訓 想減肥靠自己比較好 充足的運動 飲食控制 一定瘦得下來 不要貪心 然後要跟大家說 那些自稱“老師”的人都是騙人的 買賣也不會有墊錢的問題 買東西前多做一點功課 我就是沒有做功課然後被騙 我被騙之後上網查 才發現有很多人跟我一樣 只能說 為自己的愚蠢負責 我現在比較希望他可以來威脅我 這樣我就有證據可以告他了",talk,0,yww_123456789,F,永遠睡不飽
77,Dcard,https://www.dcard.tw/f/mood/p/255937937,2024-06-24 06:57:55,交往8年前男友過世，雖然分手了3年但我還是覺得心裡空一塊,"我跟前男友交往了大概8年，三年前他因為在交友軟體上認識另一個女生，所以我們分手了。但因為一些原因，分手也有點藕斷絲連。分手這段期間，我們各自都交了另一半，除了第一年之外，他大概每隔半個月到一個月，他都會主動打給我，跟我說些什麼，但都無關緊要的事。
前陣子的他很奇怪，很頻繁的打電話給我，跟我說以前在一起時的事，也說了他最近三年發生的一些事，和感情事。還跟我說他要出一趟遠門，要我等他回來。我也聽聽沒當一回事，畢竟當時覺得，都分手了，不需特別記得。
現在收到他過世的消息，我才發現，自己好像沒有把他忘記，他一直存在我的生活中，最近自己的生活也感覺空空的，少了些什麼......一直覺得自己是不是該去看看心理醫生.....",mood,0,,F,
78,Dcard,https://www.dcard.tw/f/mood/p/255937863,2024-06-24 06:50:32,明明可以靠顏質吃飯，偏偏想要靠實力,"明明我可以靠顏質吃飯，一些富二代妹子或有錢輕熟女找我培養感情想養我，結果我偏不信邪，覺得自己很行，硬要自己出來努力，結果搞到現在33歲，都還在科技業當經理升不上去，一年也不過就7-800多萬年薪，不上不下的。
唉，早知道就靠臉吃飯了，也不用那麼辛苦，搞到現在還沒有時間交女友。
但現在要我放下手邊工作又有點不捨。",mood,2,,M,
79,Dcard,https://www.dcard.tw/f/mood/p/255937658,2024-06-24 06:23:08,台鐵113次,"為什麼延誤兩個小時以上的才有補償
那一個多小時的呢？
而且說趕時間可以改搭橋頭捷運
那票價就不一樣了吧 也從原本的對號座變成站票",mood,0,,F,
80,Dcard,https://www.dcard.tw/f/relationship/p/255937095,2024-06-24 05:11:57,男友是有什麼毛病阿==,"這是一篇抒發文 文有點長我盡量長話短說
去年男友因朋友關係認識了一些有在玩股票的人
他接觸之後就開始沒日沒夜的在瘋股市….早上看台股晚上看美股
巴菲特都沒有他那麼忙欸？？？就連睡覺說的夢話聽起來也很像股票的東西
但至於他具體買了什麼我也不太清楚==
因為他講了我也聽不懂！！但我還是會假裝我有在認真聽哈哈哈哈
 
總之後來因為他的關係加上我自己也想學投資 我就找一天特休去辦了證券戶
剛開始的時候我只有定期定額買市值型的006208
那時候均價在8x 想說跟著大盤走應該不會錯🤔
一切都很美好直到最近…🙄🙄🙄🙄🙄🙄🙄
 
起因就是前幾個月我開始陸續買00935
結果！他知道以後三不五時就一直說我買這什麼奇怪的東西
聽都沒聽過
不然就是說幹嘛買這麼冷門的ETF==
反正就是各種貶！低！我！

我想跟他解釋的時候又跟我說你們這些韭菜就是這樣啦！難怪會被收割🙄

欸不是　憑什麼這樣就叫作韭菜阿？？？真的是有夠火大^_^
所以他買的就最好最棒不會賠 
我買的就最爛只能當韭菜嗎
邏輯死亡耶🤯
自認這檔「冷門ETF」報酬數字很不錯阿 

重！點！來！了！ 
前幾天偷瞄到他的報酬甚至比我低欸 笑死：）
每天沒日沒夜是在瞎忙什麼 
本來想說沒必要跟他為這種事吵架 但越想越氣欸
為什麼一定要按照他的方式才是好的阿？

想問大家的男友會這樣嗎…
玩個股、美股的就看不起買ETF的人嗎？",relationship,7,,F,
